"Modified Atkins Diet, NIA Diet for Seniors",NCT02521818,N/A,"AD, MCI",38,12 w,Feasibility for MAD Group; Feasibility for Control Group; Efficacy for Cognition; Efficacy for Function,,2015,2019; Completed,,,suppl,
"Computerized cognitive training, Computerized games",NCT02205710,N/A,"AD, MCI",99,"Baseline, week 5",Change in ratings on cognitive training survey; Change in neural activity; Change in performance on neuropsychological tests; Change in ratings of psychological wellbeing,,2014,2019; Completed,,,device,
"Electrical Brainstem Responses, Olfactory Tests, Visual Deprivation",NCT02761707,,"PD, PSP, AD, MSA",54,20 Minutes,"Latency, amplitude, and area under the curve of brainstem reflex response; Score on the University of Pennsylvania Smell Identification Test; Score on the Odor Discrimination/Memory Test; Score on an Odor Detection Threshold Test",,2016,2019; Completed,,,biom,
Allopregnanolone injection (intravenous solution),NCT02221622,P1,"AD, MCI",24,Baseline and Week 13,Safety profile: Adverse events; Safety profile: Clinical laboratory measurements; Safety profile: ARIA; Safety profile: Physical and neurological examination; Tolerability - Maximum tolerated dose (MTD); Pharmacokinetic profile after single and multiple doses: Maximum Concentration (Cmax); Pharmacokinetic profile after single and multiple doses: time attain to Cmax (Tmax); Pharmacokinetic profile after single and multiple doses: Area under the curve (AUC); Pharmacokinetic profile after single and multiple doses: Drug Clearance (CL); Pharmacokinetic profile after single and multiple doses: apparent volume of distribution at steady state (Vss); Cognitive tests (ADAS-Cog; MMSE/MoCA; ADCS-CGIC; CogState); Brain MRI volumetrics,,2014,2019; Completed,,,drug,
VX-745,NCT02423122,P2,"MCI, AD",16,Day 84,Number of 11C-PiB Responders; Percent Change From Baseline in Amyloid Plaque Burden by 11C-PiB PET; Wechsler Memory Scale (WMS) Delayed Recall Composite; Wechsler Memory Scale (WMS) Immediate Recall Composite,,2015,2019; Completed,,,drug,
"Verubecestat 12 mg (Parts 1 and 2), Verubecestat 40 mg (Parts 1 and 2)",NCT01953601,P3,"AD, MCI",1454,Baseline and Week 104 in Part 1,Part 1 (Base Study). Mean Percent Change From Baseline in Cerebrospinal Fluid (CSF) Total Tau Concentration at Week 104; Part 1 (Base Study). Least Squares Mean Change From Baseline in Alzheimer's Disease Cooperative Study-Activities of Daily Living Inventory (Mild Cognitive Impairment Version) (ADCS-ADL MCI) Score at Week 104; Part 1 (Base Study). Least Squares Mean Change From Baseline in Composite Cortical Amyloid Standard Uptake Value Ratio (SUVR) Assessed With Amyloid Tracer [18F]Flutemetamol Using Positron Emission Tomography (PET) Imaging at Week 104; Part 1 (Base Study). Least Squares Mean Percent Change From Baseline in Total Hippocampal Volume (THV) at Week 104; Part 1 (Base Study). Least Squares Mean Change From Baseline in the 3-Domain Composite Cognition Score (CCS-3D) at Week 104; Part 1 (Base Study). Estimated Least Squares Mean Difference Between the Last (Week 104) and First (Week 13) Post-dose CDR-SB Assessment; Part 1 (Base Study). Event-Rate Per 100 Participant Years for Progression to a Clinical Diagnosis of Probable AD Dementia; Part 2 (Extension Study). Percentage of Participants Who Discontinued From Study Drug Due to an Adverse Event (AE); Part 2 (Extension Study). Percentage of Participants Who Experienced ≥1 Adverse Event (AE); Part 1 (Base Study). Percentage of Participants Who Discontinued From Study Drug Due to an Adverse Event (AE); Part 1 (Base Study). Percentage of Participants Who Experienced ≥1 Adverse Event (AE); Part 2 (Extension Study). Mean Change From Baseline in Clinical Dementia Rating Sum of Boxes (CDR-SB) Score at Week 130; Part 1 (Base Study). Least Squares Mean (LSM) Change From Baseline in Clinical Dementia Rating Sum of Boxes (CDR-SB) Score at Week 104,,2013,2019; Terminated,,,drug,
"MK-4334, Donepepzil",NCT03740178,P1,"MCI, AD",12,"Day 14: Pre-dose and 0.5, 1, 2, 3, 4, 6, 8, 12, 24, 48, 120, 240, 360, and 480 hours after MK-4334 administration",Number of Participants Experiencing an Adverse Event (AE); Number of Participants Discontinuing Study Treatment due to an Adverse Event; Plasma Steady State Concentration at 24 Hours (C24) of MK-4334; Plasma Steady State Area Under the Concentration-Time Curve from 0 to 24 hours (AUC0-24) of MK-4334; Plasma Steady State Maximum Concentration (Cmax) of MK-4334; Plasma Steady State Apparent Half-Life (t1/2) of MK-4334; Plasma Steady State Time to Maximum Concentration (Tmax) of MK-4334; Plasma Steady State Apparent Clearance (CL/F) of MK-4334; Plasma Steady State Apparent Volume of Distribution (Vz/F) of MK-4334,,2018,2019; Not yet recruiting,,,drug,
"Amyvid PET Scan, T807 PET scan",NCT02266563,,"MCI, CTE",46,2 years,Uptake of [18F]T807 in the brain; Uptake of [18F]AV-45 in the brain; Neuropsychological data composite score,,2014,2019; Completed,,,biom,
Observational Study,NCT02964611,,"FTDLD, PD, AD",120,"one time visit, through study completion of 3 years","Personality via the Interpersonal Adjectives Scales and differences between AD, PD, and FTLD; Personality via the Behaviour Inhibition/Approach Scale (BIS/BAS) and differences between AD, PD, and FTLD; Personality via the Big Five Inventory (BFI) and differences between AD, PD, and FTLD; Social cognition via Social Norms Questionnaire and differences between AD, PD, and FTLD; Social cognition via Interpersonal Reactivity Index (IRI) and differences between AD, PD, and FTLD; Social cognition via Revised Self-Monitoring Scale (RSMS) and differences between AD, PD, and FTLD; Social cognition via Social Behaviour Observer Checklist and differences between AD, PD, and FTLD; Neuropsychiatric Inventory (NPI) and differences between AD, PD, and FTLD; Clinical Dementia Rating Scale (CDR) and differences between AD, PD, and FTLD; Functional Activities Questionnaire (FAQ) and differences between AD, PD, and FTLD; Behavioural Tests composite score and differences between AD, PD, and FTLD; Emotion Evaluation Task (EET) portion of The Awareness of Social Inference Test and differences between AD, PD, and FTLD; Geriatric Depression Scale (GDS) and differences between AD, PD, and FTLD; Neuroimaging and differences between AD, PD, and FTLD",,2016,2019; Recruiting,,,biom,delete
Observational Study,NCT02964637,,"FTDLD, PSP, ALS",100,One time visit through study completion of 5 years,Structural and Functional Diffferences between the FTLD groups via MRI of the brain; Differences between the FTLD groups via PET imaging of the brain,,2016,2019; Recruiting,,,biom,delete
"davunetide (AL-108, NAP)",NCT01056965,P1,"PSP, CBD, FTDLD",12,12 w,"Safety evaluations will be performed by recording clinical adverse events at each study visit. Clinical laboratory, ECGs, physical examinations will be conducted.; PSP Rating Scale; Clinician's Global Impression (CGI-ds); Schwab and England Activities of Daily Living scale (SEADL); MRI brain ventricular volume; Repeatable Battery for the Assessment of Neuropsychological Status (RBANS); Unified Parkinson's Disease Rating Scale (UPDRS); Neuropsychiatric Inventory (NPI); Geriatric Depression Scale (GDS); CSF biomarkers will assess total tau, phosphorylated tau, and amyloid beta peptide (1-42); Saccadic Eye movements - vertical and horizontal total saccade time; Clinical Dementia Rating (CDR); Functional Activities Questionnaire (FAQ)",,2010,2019; Completed,,,drug,
[123I]CLINDE,NCT00612872,P1,"AD, PD",46,6 mos,"To assess the dynamic uptake and washout of 123-I CLINDE, using single photon emission computed tomography (SPECT) in similarly aged healthy controls and subjects with Alzheimer (AD) or Parkinson disease (PD).",,2008,2019; Terminated,,,biom,
[18F] PBR06,NCT01028209,P1,"AD, PD",12,1 year,"To evaluate [18F] PBR06 PET imaging as a tool to detect microglial activation in the brain of AD, PD and MS research participants.",,2009,2019; Terminated,,,biom,
Neuropsychological tests,NCT03900936,,"AD, MCI",20,3 years,Predicting progression; Social Characteristics and questionnaires,,2019,2019; Recruiting,,,device,
Nelotanserin,NCT02871427,P2,"PD, DLB",80,24 w,"Long-term safety and tolerability will be evaluated based on incidence of adverse events (AEs) and significant changes in physical examinations, vital signs, ECGs, and clinical laboratory assessments over time during treatment.; Long-term effectiveness will be evaluated based on change in the frequency and severity of visual hallucinations (as recorded by patient's caregiver) and/or REM sleep behaviors (based on a clinical evaluator) over time during treatment.",,2016,2019; Terminated,,,drug,
"ECOCAPTURE, Cognitive and Behavioral experimental tasks, ICM_APATHY_TASKS, Neurohormonal mechanisms, Supplementary Neuropsychological Assessment - Parkinson's Disease",NCT03272230,N/A,"FTDLD, PD",135,At day 1,NART; BREF (FAB english); HAYLING; HAD; Gray matter volume; White matter volume; Cerebral Spinal Fluid volume; Leptin; Adiponectin; Insulin; C-Peptide; FPG; HbA1C; K+; Uric acid; Creatinine; Total Protein; CRP; AST; ALT; GGT; Cholesterol; Triglycerides; EBI; ACDD; Brain lesion localization; IL-6; Pupil Diameter y; ICM_APATHY_TASKS; MMSE; DAS; STARKSTEIN (SAS); MATTIS; MADRS; Occurrence of each behavior from the ethogram; Frequency of each behavior from the ethogram; Duration of each behavior from the ethogram; Number of different behaviors; Activity classes; Body positions; Energy expenditure; MET; Steps; Acceleration intensity; Pupil Diameter x; HDL cholesterol; LDL cholesterol; Glycerol; FFAs; TSH; QUIP; BIS-11; Mini-SEA; STROOP; ECMP; QUIP-RS,,2017,2019; Recruiting,,,device,
lumbar puncture,NCT03217396,,"ALS, PD, AD",150,September 01 2020,Identification of predictive biomarkers of SM using an ex vivo chimeric model; Identification of new therapeutic targets in MS.,,2017,2019; Recruiting,,,delete,biom
Muscle relaxation using full body massage machine,NCT03507192,N/A,"AD, MCI",60,One year after receiving muscle relaxation massage everyday.,cortical thickiness in 3D MRI; functional connectivity in functional MRI,,2018,2019; Unknown status,,,behav,
"Augmented Standard Care (ASC), Resource Nurse Care (RNC), Advanced Practice Nurse Care (APNC)",NCT00294307,,"AD, MCI",814,"At hospital admission and at 2-, 6-, 12-, and 26-w post-discharge",Patient - Function; Caregiver - Burden; Patient - Health Care Costs; Patient - Time to first rehospitalization or death; total rehospitalization days; Patient - Total rehospitalizations; Patient - Cognitive Function; Patient - Care Management; Patient - Symptoms (Physical and depressive symptoms); Patient - Neuropsychiatric Behaviors; Patient - Quality of Life; Patient/Caregiver - Satisfaction with care; Caregiver - Depressive Symptoms,,2006,2019; Completed,,,behav,
Dysphagia Detection System,NCT03387267,N/A,"AD, PD",442,The study procedure of simultaneous VFSS and DDS measurement using moderate barium (MOD-Ba) will be completed in one day.,The primary efficacy of the Dysphagia Detection System (DDS) will be measured as the sensitivity & specificity obtained from comparing the DDS swallow safety outcome simultaneously to the VFSS swallow safety outcome for thin barium (THIN-Ba) stimuli; The sensitivity & specificity DDS for swallow safety using MILD-Ba will be measured as the sensitivity & specificity obtained from comparing the DDS predicted swallow safety outcome with the VFSS swallow safety outcome for MILD-Ba; The sensitivity & specificity DDS for swallow efficiency using THIN-Ba will be measured as the sensitivity & specificity obtained from comparing the DDS predicted swallow efficiency outcome with the VFSS swallow efficiency outcome for THIN-Ba; The sensitivity & specificity DDS for swallow efficiency using MILD-Ba will be measured as the sensitivity & specificity obtained from comparing the DDS predicted swallow efficiency outcome with the VFSS swallow efficiency outcome for MILD-Ba; The sensitivity & specificity DDS for swallow safety using MOD-Ba will be measured as the sensitivity & specificity obtained from comparing the DDS predicted swallow safety outcome with the VFSS swallow safety outcome for MOD-Ba; The sensitivity & specificity DDS for swallow efficiency using MOD-Ba will be measured as the sensitivity & specificity obtained from comparing the DDS predicted swallow efficiency outcome with the VFSS swallow efficiency outcome for MOD-Ba,,2018,2019; Terminated,,,device,
Collaborative Dementia Care Program,NCT01699503,N/A,"MCI, AD",4005,12 m,Number of Participants With an Advance Directive at 12 Months; Number of Participants With Health Care Utilization; Generalized Anxiety Disorder Scale (GAD-7); Patient Health Questionnaire (PHQ-9); Health Related Quality of Life (HRQOL),,2012,2019; Completed,,,behav,
"GammaSense Stimulation System (non-invasive, non-significant risk)",NCT03661034,N/A,"AD, MCI",20,"Baseline, 3, 6, 9 and 12 m",Change in Amyloid Positron Emission Tomography (PET) Scan; Adverse Events; Alzheimer's Disease Assessment Scale- Cognitive Subscale (ADAS-Cog),,2018,2018; Unknown status,,,device,
Intranasal Insulin,NCT02064166,P2,"PD, MSA",15,Baseline and post-treatment,"Modified Hoehn and Yahr Scale; Beck Depression Inventory Score (BDI); Cognitive Impairment Using Montreal Cognitive Assessment (MoCA); Brief Visuospatial Memory Test-Revised (BVMT-R); Gait Analysis (4-meter Test); Unified Parkinson's Disease Rating Scale Part III (UPDRS Part III); Change in Verbal Fluency FAS (F, A or S Words) Total Score",,2014,2018; Completed,,,drug,
Dabigatran,NCT03752294,P1,"AD, MCI",40,24-m,Evaluate dabigatran efficacy in MCI and mild AD population using changes in targeted plasma and CSF biomarker levels at 9 and 21 months; Demonstrate a reduction in decline of cognitive function related to physical functioning in placebo arm after crossing over to 12-months of active treatment; Changes in cognitive performance in placebo arm after cross-over to open-label treatment phase; Safety and tolerability of dabigatran in experimental population (MCI and mild AD populations) based on reported serious and adverse events; Evaluation of cognitive performance in placebo arm after cross-over to open-label treatment phase,,2018,2018; Not yet recruiting,,,drug,
transcranial direct current stimulation (tDCS),NCT03422250,N/A,"AD, FTDLD",66,"Baseline, post tDCS (week 3)",Change from baseline in behavioral symptom severity; Change from baseline in clinical disease severity; Change from baseline in functional connectivity; Change from baseline in perfusion; Change from baseline in cognition: memory; Change from baseline in cognition: language; Change from baseline in cognition: executive function; Change from baseline in cognition: visuospatial function; Change from baseline in cognition: emotion recognition; Change from baseline in structural connectivity,,2018,2018; Completed,,,device,
Navigated Care,NCT02213458,N/A,"FTDLD, AD",780,One year,Quality of Life-AD; Health care utilization; Caregiver burden; Satisfaction with Dementia Care; Caregiver depression; Caregiver self-efficacy,,2014,2018; Completed,,,behav,
Transcranial direct current stimulation,NCT03721887,N/A,"MSA, PD",40,baseline to week 4,EEG recording before and after the tDCS session; Electromyography recording before and after the tDCS session; Change in Unified Parkinson's Disease Rating Scale (UPDRS) Part III before and after the tDCS session; Change in Unified Multiple System Atrophy Rating Scale (UMSARS) subscores (UMSARS-1 and UMSARS-2) before and after the tDCS session; Change in New freezing of gait questionnaire (NFOG-Q) before and after the tDCS session; Change in Tinetti's Mobility Index total score before and after the tDCS session; Change inParkinson's Disease Questionnaire 39 (PDQ-39) before and after the tDCS session; Change in Short Form 36 Health Survey (SF-36) total score before and after the tDCS session,,2018,2018; Recruiting,,,device,
"Microcannula Harvest Adipose, Centricyte 1000",NCT03297177,N/A,"CBD, AD, PD",300,6 month intervals for up to 5 years,Number of participant with adverse events (AE) or severe adverse events (SAE); Neurological Function; Neurological Tested Functions; Magnetic Resonance Imaging (MRI),,2017,2018; Not yet recruiting,,,stem,
"Warfarin, Dimebon",NCT00827034,P1,"HD, AD",14,7+18 d,"Single dose pharmacokinetics (Cmax, AUCinf) of warfarin 25 mg with and without co-administration of steady-state Dimebon 20 mg TID in healthy adult subjects.; Single dose pharmacodynamics (INRmax, AUC-INR) of warfarin 25 mg with and without co-administration of steady-state Dimebon 20 mg TID in healthy adult subjects.; Safety and tolerability ( adverse event monitoring, physical examinations, vital signs, ECG's and clinical laboratory tests) of multiple doses of Dimebon 20 mg TID with a single dose of warfarin 25 mg in healthy adult subjects.",,2009,2018; Completed,,,drug,
"Mito-Food Plan, Cellular Repair Therapy",NCT03630419,P1/P2,"AD, MCI",5,3 m,Change in Mini Mental State Exam (MMSE) from Baseline to Week 12; Change in inflammation as measured through bioimpedance analysis from baseline to week 12; Change in Montreal Cognitive Assessment (MoCA) from Baseline to Week 12; Change in Quality of Life in Alzheimer's Disease (QOL-AD) from Baseline to Week 12; Change in A1C levels from Baseline to Week 12,,2018,2018; Completed,,,suppl,
MK-8931,NCT02910739,P1,"AD, MCI",16,Up to 14 d following MK-8931 40 mg administration.,Number of Participants Discontinuing Study Due to an Adverse Event; Number of Participants Experiencing an Adverse Event; Apparent Volume of Distribution of MK-8931 During the Terminal Phase After Extravascular Administration (Vz/F); Apparent Terminal Half-Life of MK-8931 (t1/2); Time to Maximum Observed MK-8931 Plasma Drug Concentration (Tmax); Apparent Clearance of MK-8931 After Extravascular Administration (CL/F); Plasma Concentration of MK-8931 at 24 Hours (C24hr); Area Under the Concentration Versus Time Curve of MK-8931 From 0 to 24 Hours (AUC0-24hr); Area Under the Concentration Versus Time Curve of MK-8931 From 0 to the Time of the Last Quantifiable (Above LLOQ) Sample (AUC0-last); Maximum Observed Plasma Concentration of MK-8931 (Cmax); Area Under the Concentration Versus Time Curve of MK-8931 From 0 to Infinity (AUC0-∞),,2016,2018; Completed,,,drug,
Laughter Therapy,NCT02750982,N/A,"PD, HD, ALS, AD",24,Change from Baseline to 8 w,"Patient Health Questionnaire (PHQ-9, for depression); Generalized Anxiety Disorder 7-item scale (GAD-7, for anxiety); The General Self-Efficacy Scale (GSE)",,2016,2018; Completed,,,behav,
"[18F]MK-6240, ~185 MBq, [18F]MK-6240, ~160 MBq",NCT02562989,P1,"AD, MCI",13,Up to 16 w following initial dose of [18F]MK-6240,Intra-subject Test-Retest (T-RT) Variability of Standardized Uptake Value Ratio (SUVR) in Brain Regions of Interest; Standardized Uptake Value Ratio (SUVR) of [18F]MK-6240 in Brain Regions of Interest; Organ Effective Dose of [18F]MK-6240; Effective Dose of [18F]MK-6240; Number of Participants Who Discontinued Study Due to an AE; Number of Participants With Adverse Events (AEs),,2015,2018; Completed,,,biom,
carnosine supplementation,NCT03330470,N/A,"PD, MCI",100,up to 36 m,glucose tolerance; learning/working memory; motoric functions - Berg Balance Scale; habitual physical activity; physical fitness,,2017,2018; Unknown status,,,suppl,
Transcranial direct current stimulation (tDCS),NCT01958437,N/A,"AD, MCI",44,Outcome assessed after each of the 2 sessions,Egocentric; Dorsal Attention Network Connectivity During Resting-state fMRI; Hippocampal BOLD Signal During Task-based fMRI; Accuracy in Centimeters From Target Location for Allocentric,,2013,2018; Completed,,,device,
EEG scan,NCT03644043,,"MCI, AD",2000,10 d,Patient meeting Appropriate Use Criteria (AUC) with EEG brain scan - P300 and P50 will be measured for correlation between P300 and P50 with amyloid deposition.,,2018,2018; Unknown status,,,device,
"Sapphire II, Aftobetin-HCl, Positron Emission Tomography",NCT02928211,P1,"MCI, AD",105,"through study completion, approximately 4 w","Paired pre-ligand and post ligand fluorescent uptake values (FUV); Determination of success (yes or no); The overall diagnostic precision for each combination of Aftobetin-HCl administrations and Fluorescent Uptake Value (FUV); Estimates of sensitivity and specificity of MCI and mild AD subjects compared to cognitively normal subjects; Safety of Sapphire II procedure as determined by instances of Adverse Events; Characterization of maximal fluorescence after 1, or potentially 3, ointment administrations; Intra-class correlation of the repeatability of the Sapphire II measurements to verify the system's reliability for reproducible results; Correlation of FUV to PET amyloid status",,2016,2018; Unknown status,,,biom,
Florbetapir F 18,NCT01518374,P2,"AD, MCI",1768,48 hours,Number of Participants Experiencing Treatment-emergent Adverse Events Considered Related to Florbetapir Administration,,2012,2018; Completed,,,biom,
voice recordings,NCT03577483,N/A,"PD, MSA",90,Day 1,Differences between groups in Dysphonia Severity Index (DSI).; Differences between groups in Acoustic Voice Quality Index (AVQI); Differences between groups in oral airflow (dm3/s).; Differences between groups in glottal leakage (cc/s/dB); Differences between groups in intra-oral pressure (hPa).; Differences between groups in perceptive analysis of dysphonia based on total GRBAS-I scale scores (range 0-18); Differences between groups in perceptive analysis of dysarthria based on French Clinical Dysarthria Battery scores,,2018,2018; Unknown status,,,device,
3 months exercise intervention program,NCT02253732,N/A,"AD, MCI, PD",30,up to 30 m,muscle microRNAs and myokines; whole body energy metabolism; cognitive function; motoric function; Muscle functional tests,,2014,2018; Completed,,,behav,
Transcranial direct current stimulation,NCT02453763,,"AD, PD",17,Day 1,Magnetic Resonance Imaging (MRI) of therapeutic current flow,,2015,2018; Completed,,,device,
non-invasive retinal imaging,NCT03472482,,"MCI, AD",85,2 years,Diagnostic performance of OCT measurements in dementia,,2018,2018; Unknown status,,,biom,
"biomarkers, MRI and CSF",NCT01315639,N/A,"MCI, AD",1067,t0,Ratio of CSF sAPPβ and CSF sAPPα; Ratio of plasma Aβ and plasma Tau; Plasma Tau; MRI biomarkers; Mean concentration of plasma AB peptides; plasma levels of Tau protein; Mean concentration of biomarker; MRI; Transcriptomics biomarkers; Bace peptide; TACE/ADAM17; Cathepsin; sAPPβ,,2011,2018; Unknown status,,,biom,
"multimodal retinal imaging, Cerebral imaging, Neuropsychiatric testing",NCT03466177,,"MCI, AD",90,2 years,Retinal biomarkers for AD: specificity; Retinal biomarkers for AD: sensitivity; Retinal biomarkers for AD: number needed to image; Retinal biomarkers for AD: area under the curve (AUC); Retinal biomarkers for AD: receiver operating characteristic (ROC); Retinal biomarkers for AD: quantification of cerebral Aβ load by non-invasive retinal imaging against the cerebral Aβ load measured by cerebral imaging; Retinal biomarkers for AD: disease progression by measuring the change from baseline at 2 years,,2018,2018; Unknown status,,,biom,
Exendin-4 SC,NCT01255163,P2,"MCI, AD",57,18 m,Number of Participants With Incidence of Nausea; Body Mass Index (BMI); Cerebrospinal Fluid Amyloid-beta 42 (CSF Abeta42); Cerebrospinal Fluid phospho181-tau (CSF p181-tau); Cerebrospinal Fluid (CSF) Total Tau; Clinical Dementia Rating (CDR) Sum of Boxes; Clinical Dementia Rating (CDR) Global Score; Alzheimer's Disease Assessment Scale-cognitive Subscale (ADAS-cog70); Mini Mental State Examination (MMSE),,2010,2018; Terminated,,,drug,
"Robot-Assisted Gait Training (RAGT), Treadmill Gait Training (TT)",NCT01668407,N/A,"PSP, PD",80,"baseline, weekly during intervention, 6 m follow up.",6 minutes walking test.; Time Up and Go test.; Gait Parameters,,2012,2018; Completed,,,device,
PET Scan,NCT02420756,,"AD, MCI",18488,12 m,To assess the impact of amyloid PET on the management of patients meeting Appropriate Use Criteria (AUC); To assess the impact of amyloid PET on hospital admissions and emergency room visits in patients enrolled in the cohort (amyloid PET-known) compared to matched patients not in the cohort (amyloid PET-naïve) over 12 months,,2015,2017; Completed,,,biom,
Pupillometry,NCT03330353,,"PSP, ALS, AD, PD",56,2 years,Maximal Pupil Constriction; Post-illumination pupil response (PIPR),,2017,2017; Unknown status,,,device,
"Umbilical cord blood therapy, Filgrastim",NCT02236065,N/A,"PD, ALS",10,6 m,Changes in Berg Balance Scale; Changes in the Level of Disability; Changes in Standardized Gross Motor Function; Changes in Motor Performance; Changes in ALSFRS-R; Changes in UPDRS; Changes in Brain MRI; Changes in Brain PET; Number of adverse events and participants with those adverse events,,2014,2017; Completed,,,sem,
