Insulin glulisine,NCT02503501,P2,"AD, MCI",49,Baseline and 6 m,Change in Functional Performance as Measured by the Functional Activities Questionnaire (FAQ); Change in Functional Performance as Measured by the Clinical Dementia Rating (CDR) Scale; Change in Cognition as Measured by the Alzheimer's Disease Assessment Scale - Cognitive 13 (ADAS-Cog 13),,2015,2020; Terminated,,,drug,
GE180 PET Scan,NCT03702816,P2,"PD, AD",70,Baseline,Linear Regression Model Assessing Cognitive Performance and Regional Microglial Activation; Repeated Measures Analyses to Asses Change in Microglial Activation Over Time; Linear Regression Model Assessing Cognitive Performance and Global Microglial Activation,,2018,2020; Enrolling by invitation,,,biom,
Valaciclovir 500Mg Tablet,NCT02997982,P2,"MCI, AD",33,Treatment day 28,Cerebrospinal fluid (CSF) Total Tau; Cerebrospinal fluid (CSF) Neurofilament light chain (NFL); Cerebrospinal fluid (CSF) phosphorylated Tau (p-Tau); Cerebrospinal fluid (CSF) Amyloid beta 1-42; PET/CT: [18F]-FHBG accumulation within the central nervous system (CNS); PET/CT: Location of [18F]-FHBG accumulation; PET/CT: [18F]-FHBG accumulation; Mini Mental State Examination - Swedish Revision (MMSE-SR); Cerebrospinal fluid (CSF) acyclovir concentration; Cerebrospinal fluid (CSF) 9-carboxymethoxymethylguanine (CMMG) concentration; Serum acyclovir concentration; Serum 9-carboxymethoxymethylguanine (CMMG) concentration; Proportion completing the [18F]-FHBG-PET/CT investigations; Proportion completing the 28 days treatment with valaciclovir at specified doses,,2016,2020; Completed,,,drug,
"physical exercise alone (PES) first, cognitive exercise alone (iCE) first, interactive Physical and Cognitive Exercise (iPACES™)",NCT03069391,N/A,"MCI, AD",31,change over time in score from baseline to 3 m,executive function composite score; brain-derived neurotrophic factor (BDNF); Sit-Stand Test,,2017,"2020; Active, not recruiting",,,behav,
deferiprone,NCT02880033,N/A,"ALS, PD",90,12 m,hydroxyl radical measured; adenosine triphosphate production measured by seahorse; oxygen consumption measured by seahorse; free reactive iron (ferrous iron); lipid peroxidation measured by Fluorescence-activated cell sorting,,2016,2020; Completed,,,drug,
Lumbar puncture,NCT04131491,N/A,"AD, MCI",80,"Patients will have their investigations at inlcusion (time frame: 8 w), after 1 year (time frame: 4 w) and after 2 years (time frame: 4 w).","Prevalence, expressed as percentage, of subclinical epileptiform activity in MCI due to AD patients, compared to healthy controls.; Odds ratio for conversion to clinical AD when comparing MCI patients with and without subclinical signs of epilepsy at the baseline evaluation.",,2019,2020; Recruiting,,,delete,biom
"Music lessons, Training intervention",NCT03444181,N/A,"MCI, AD",135,6 m,Brain age; Depression symptoms; Living independently at home; Language abilities; Sensori-motor functions; Activities of daily living; Disease progression; Cognitive functioning; Integrity of fibre tracts; Resting-state functional connectivity; Working alliance,,2018,2020; Recruiting,,,behav,
Categorical Language Fluency Smartphone Application,NCT02848404,N/A,"AD, MCI",20,after 4-w treatment,Application usage log; Subjective Memory Complaint Questionnaire; Geriatric Depression Scale; Korean version of MMSE for dementia screening,,2016,2020; Completed,,,device,
Radiopharmaceuticals,NCT03926702,Early P1,"MCI, PSP, AD",18,3 hours,Positron-emission tomography (PET) scan results,,2019,"2020; Active, not recruiting",,,biom,
SmartPrompt smartphone application,NCT04313582,N/A,"MCI, AD",80,2 w (after SmartPrompt Condition),Response Time (RT) to Alarm and Prompts Average; Participant Open-Ended Structured Interview; Caregiver Task Completion Rating Sum of SmartPompt Condition; Caregiver Task Completion Rating Sum of Control Condition; Caregiver Task Burden Sum of SmartPompt Condition; Caregiver Task Burden Sum of Control Condition; Participant Activity Log Sum of SmartPompt Condition; Participant Activity Log Sum of Control Condition; Participant Frustration Sum of SmartPompt Condition; Participant Frustration Sum of Control Condition; Caregiver System Usability Scale (C-SUS); Caregiver Problem Report Sum; Technical Support Log Total; Total Training Time; SmartPrompt Use Sum; Caregiver Open-Ended Structured Interview,,2020,2020; Recruiting,,,device,
"real anodal transcranial direct current stimulation, real transcranial alternating current stimulation, sham transcranial electric current stimulation",NCT03351452,N/A,"MCI, AD",28,follow-up after 24 hours,Performance on immediate cued recall task; Performance on delayed cued recall task; task-dependent BOLD activity; resting-state BOLD activity; Performance on cued recall task; Performance on recognition task,,2017,2020; Completed,,,device,
repetitive transcranial magnetic stimulation (rTMS),NCT04294888,N/A,"MCI, AD",40,up to 5 w,Paired Associative Face Name Memory Test; Changes in intrinsic functional connectivity,,2020,2020; Recruiting,,,device,
18F-AV-1451 (Tau-PET tracer),NCT02958670,N/A,"MCI, AD",150,Baseline and two years,Volume of Interest (VOI) or Voxel based assessment of 18F-AV-1451-PET-signal; Transition from one clinical state to another (e.g. MCI to AD) worsening of clinical function measured as an increase in CDRSOB-score of one; Neuropsycholgical test performance; Magnetresonance Tomography (MR) readouts; Blood and CSF-biomarker-read outs,,2016,2020; Enrolling by invitation,,,biom,
"real anodal transcranial direct current stimulation (tDCS), sham transcranial direct current stimulation (tDCS)",NCT03227185,N/A,"MCI, AD",55,1 day after on-site visit,Neurotransmitter levels; Episodic memory performance - learning curve; Episodic memory performance - delayed recall 1; Episodic memory performance - delayed recall 2,,2017,2020; Terminated,,,device,
"DVA, FDOCT, Pattern ERG",NCT02663531,N/A,"AD, MCI",150,1 day,Flicker induced increase in retinal blood flow,,2016,2020; Recruiting,,,biom,
"Closed loop acoustic stimulation, Sham acoustic stimulation",NCT04277104,N/A,"AD, MCI",72,"Assessed four times: on the morning before the first intervention night, on the morning after the last intervention night, one week after and 3 m after the intervention",Change from baseline episodic memory performance after three nights of intervention; Change from baseline performance in computer-based verbal new learning task (episodic memory) after three nights of intervention; Improvements in sleep physiology; Improvement in episodic memory performance at follow-ups; Improvement in new learning of episodic memory at follow-ups; Decreases in plasma amyloid-beta; General cognitive functions: working memory; General cognitive functions: cognitive flexibility; General cognitive functions: cognitive inhibition,,2020,2020; Recruiting,,,device,
[18F]MNI-958,NCT03545789,P1,"PSP, AD",16,1 year,"Tracer uptake will be evaluated in regions of interest for analysis of regional [18F]MNI-958 binding/uptake and expressed in SUV by using established methods for normalization for 4 AD, 7 PSP, and 3 HV subjects.",,2018,2020; Completed,,,device,
"Metabolic Cofactor Supplementation, Sorbitol",NCT04044131,P2,"AD, PD",120,4 w and 12 w,"Mini Mental State Examination (MMSE); Alzheimer's Disease Assessment Scale-cognitive subscale (ADAS-cog); Alzheimer's Disease Cooperative Study - Activities of Daily Living (ADCS-ADL); Changes in creatinine kinase (CK) level from baseline; Change in thyroid-stimulating hormone (TSH) level from baseline; Unified Parkinson's Disease Rating Scale (UPDRS); Volumetric Magnetic resonance Imaging (MRI) and resting state functional magnetic resonance imaging (rest-fMRI); Neuropsychiatric Inventory (NPI); Montreal Cognitive Assessment (MoCA); Changes in serum omic profile from baseline; Microbiota analysis; Monitoring of adverse events; Change in heart rate from baseline; Change in blood pressure from baseline; Change in waist and hip circumference from baseline; Change in body weight from baseline; Change of complete blood count from baseline; Changes in liver function tests (alkaline phosphatase (ALP), alanine aminotransferase (ALT), Aspartate aminotransferase (AST), gamma-glutamyl transferase (GGT), total and direct Bilirubin, Albumin) from baseline; Changes in blood lipid levels (total cholesterol (TC), triglyceride (TG), low density lipoprotein (LDL-C), high density lipoprotein (HDL-C)) from baseline; Changes in kidney function tests (creatinine, urea, urate, sodium, potassium) from baseline; Change in blood insulin level from baseline; Change in glycated haemoglobin (HbA1c) level from baseline; Changes in blood glucose levels from baseline",,2019,2020; Recruiting,,,suppl,
Deferiprone 600mg delayed release tablets,NCT03234686,P2,"AD, MCI",171,12 m,"Efficacy of Deferiprone; Incidence of Treatment-Emergent Adverse Events (Safety and Tolerability); Brain Iron Levels; The effect of Deferiprone on the episodic memory, executive function and attention composites; The Association with Iron levels in the Brain and Cognitive Decline; The Potential for Brain Iron Load to be Used to Stratify Responsiveness to Deferiprone; The Potential for APOE Genotype to be Used to Stratify Responsiveness to Deferiprone",,2017,2020; Recruiting,,,drug,
[18F]Flutemetamol,NCT02778971,,"AD, MCI",50,within 30 d post amyloid PET scan,Proportion of drug management options changed after amyloid PET; Change in % likelihood of Alzheimer's disease (AD) diagnosis after amyloid PET scan; Proportion of care practices changed after amyloid PET scan; Proportion of change in leading diagnosis after amyloid PET; Change in physician confidence in leading diagnosis; Change in care partner's confidence in diagnosis after amyloid PET; Change in care partner satisfaction with evaluation after amyloid PET; Change in care partner assessment of the quality of evaluation after amyloid PET; Proportion of care partners finding amyloid PET scan worthwhile; Proportion exhibiting increased behavior disturbance during amyloid scan visit; Proportion exhibiting increased behavior disturbance when the diagnosis is given; Percentage of recommended care practices adhered to after amyloid PET scan; Percentage of recommended drug management adhered to after amyloid PET scan; Change in the interpretation of amyloid PET scans with semi-quantitative image analysis,,2016,2020; Recruiting,,,biom,
transcranial direct current stimulation (tDCS),NCT04237948,N/A,"PD, PSP",20,Changes from Baseline to immediately after stimulation,PSP rating scale (PSP-RS); Falls; Cognitive testing; Static Balance- area of sway; Tinetti Balance test (TBT); Static Balance: wearable sensor analyses - velocity; Gait speed; Turning speed; Activity of daily living,,2020,2020; Completed,,,device,
repetitive transcranial magnetic stimulation,NCT04222218,N/A,"PD, PSP",20,Changes from Baseline to immediately after stimulation,"Short Physical Performance Battery, total time (SPPB); Timed up and Go tests, total time (TUG); Static Balance tests, total time; Tinetti Balance test (TBT); Static Balance- area of sway; PSP rating scale (PSP-RS); Static Balance: wearable sensor analyses - velocity; Static Balance: wearable sensor analyses - acceleration; Static Balance: wearable sensor analyses - jerk",,2020,2020; Completed,,,device,
Flortaucipir,NCT01231971,,"AD, MCI",1182,1 year,"Correlations among biomarkers and biomarker change; APOE genotype, low CSF Aβ42, positive amyloid imaging with florbetapir F 18 (AV-45); Rate of change of tau and extent of tau deposition as measured by flortaucipir (18F-AV-1451); Extent of amyloid deposition as measured by Florbetapir F 18; Group differences for each imaging and biomarker measurement; Rate of volume change of whole brain, hippocampus and other structural MRI measures; Rate of Decline as measured by: Cognitive Tests, Activities of Daily Living, and CDR Sum of Boxes; Rate of conversion will be evaluated among all five groups; Rates of change on each specified biochemical biomarker; Rates of change of glucose metabolism (FDG-PET); Rate of cognitive decline using computer based testing as measured by Cogstate Brief Battery (CBB)",,2010,2020; Completed,,,biom,
Flutemetamol (Vizamyl),NCT02353949,P3,"MCI, AD",11,Six Months after initiation of standard treatment,Comparisons of change from pre-treatment assessment of ADCS-CGIC after 6 months in clinical constellations defined by clinical diagnosis and Flutemetamol-status; Change from pre-treatment assessment on the decision regret scale after three months; Change from pre-treatment assessment on the decision regret scale after six months; Change of ADAS-cog 11 score compared to pre-treatment assessment in Flutemetamol positive subjects with a postscan diagnosis of AD and start of cholinesterase inhibitors as standard treatment.; Change of ADCS-ADL score compared to pre-treatment assessment in Flutemetamol positive subjects with a postscan diagnosis of AD and start of cholinesterase inhibitors as standard treatment.; Change of ADCS-CGIC score compared to pre-treatment assessment in Flutemetamol positive subjects with a postscan diagnosis of AD and start of cholinesterase inhibitors as standard treatment.; Change of MMSE score compared to pre-treatment assessment in Flutemetamol positive subjects with a postscan diagnosis of AD and start of cholinesterase inhibitors as standard treatment.; Comparisons of change from pre-treatment assessment of ADAS-Cog-11 after 6 months in clinical constellations defined by clinical diagnosis and Flutemetamol-status; Comparisons of change from pre-treatment assessment of ADCS-ADL after 6 months in clinical constellations defined by clinical diagnosis and Flutemetamol-status; Comparisons of change from pre-treatment assessment of MMSE after 6 months in clinical constellations defined by clinical diagnosis and Flutemetamol-status,,2015,2020; Terminated,,,biom,
"Computerized cognitive battery: Cognigram (CG), The NeuroCatch™ Platform (NCP)",NCT03676881,,"MCI, AD",36,"baseline, 6 m, 12 m, 24 m, and 36 m follow ups",Longitudinal change in ERP´s latencies for Basic Attention (P300); CG scores (accuracy and reaction speed); MoCA scores; ERP´s amplitudes for Auditory sensation (N100); ERP´s amplitude for Cognitive processing (N400); ERP´s amplitude for Basic Attention (P300); ERP´s latency for Auditory sensation (N100); ERP´s latency for Cognitive processing (N400); ERP´s latency for Basic Attention (P300); Longitudinal changes in CG scores; Longitudinal changes in MoCA scores; Longitudinal change in Mini-mental state examination (MMSE); Longitudinal change in FAQ; Longitudinal change in GPCOG scores; Longitudinal change in Rey-Osterrieth Complex Figure test (RCFT); Longitudinal change in Hopkins Verbal Learning test (HVLT-R); Longitudinal change in Trail Making Tests A and B; Longitudinal change in Semantic Verbal Fluency test (animals).; Longitudinal change in ERP´s amplitudes for Auditory sensation (N100); Longitudinal change in ERP´s amplitudes for Cognitive processing (N400); Longitudinal change in ERP´s amplitudes for Basic Attention (P300); Longitudinal change in ERP´s latencies for Auditory sensation (N100); Longitudinal change in ERP´s latencies for Cognitive processing (N400),,2018,"2020; Active, not recruiting",,,device,
"tDCS, Exercise Education, Sham tDCS",NCT03670615,N/A,"AD, MCI",30,Change over 2 w (Midpoint to Endpoint),Change in global cognitive function: The Montreal Cognitive Assessment (MoCA) Total Scores; Changes in concentration of blood biomarkers of brain plasticity; Change in neuropsychiatric symptoms: The Neuropsychiatric Inventory (NPI); Change in cognition: n-back reaction time; Change in cognition: n-back accuracy; Change in cognition: The Word Recall Task from the Alzheimer's Disease Assessment Scale-Cog (ADAS-Cog); Change in cognition: The Word Recognition Task from the Alzheimer's Disease Assessment Scale Cog (ADAS-Cog),,2018,2020; Recruiting,,,device,
Naturalistic observation,NCT03672448,,"DLB, AD, MCI",10000,5 years,"Prevalence, incidence of neurocognitive disorder; Prevalence, incidence of mood disorder; conversion rate",,2018,2020; Recruiting,,,delete,
Transcranial ExAblate System,NCT02252380,N/A,"HD, PD",10,At the time of ExAblate procedure,Severity of Device and Procedure Related Complications,,2014,"2020; Active, not recruiting",,,device,
"GammaSense Stimulation System (Active Settings), GammaSense Stimulation System (Sham Settings)",NCT03556280,N/A,"AD, MCI",60,Quarterly over 6 m,Alzheimer's Disease Assessment Scale- Cognitive Subscale (ADAS-Cog); Amyloid PET/CT,,2018,"2020; Active, not recruiting",,,device,
BIIB092,NCT03658135,P1,"FTDLD, CBD",22,20 w,Incidence of Treatment-Emergent Adverse Events; Changes in Pharmacokinetic properties of BIIB092 in Plasma; Changes in Pharmacokinetic properties of BIIB092 in Cerebrospinal Fluid; Changes in Pharmacodynamic effects of BIIB092 on Cerebrospinal Fluid; Change in whole brain volume on brain MRI; Change in regional brain volume on brain MRI; Change in functional connectivity on brain MRI; Change in Cerebrospinal Fluid Biomarkers of phosphorylated tau; Change in Cerebrospinal Fluid Biomarkers of neurofilament light chain; Change in Cerebrospinal Fluid Biomarkers of total tau; Change in Schwab and England Activities of Daily Living (SEADL) scale; Changes in Functional Activities Questionnaire (FAQ); Change in Montreal Cognitive Assessment (MoCA); Change in Neuropsychiatric Inventory-Questionnaire (NPI-Q),,2018,2019; Terminated,,,drug,
NBMI,NCT04184063,P2,"PSP, MSA",16,"Day 56, 57","Pharmacokinetic parameters derived from plasma concentrations of NBMI: AUC0-∞; Pharmacokinetic parameters derived from plasma concentrations of NBMI: AUC%Extrap,obs; Changes in Non-Motor Symptoms assessment scale (NMSS) individual scale from baseline in MSA patients compared to placebo treatment; Changes in Progressive Supranuclear Palsy rating Scale (PSPRS) individual scales scores from baseline in PSP patients compared to placebo treatment; Changes in FAB individual scales scores from baseline in PSP patients compared to placebo treatment; Pharmacokinetic parameters derived from plasma concentrations of NBMI: t1/2; Pharmacokinetic parameters derived from plasma concentrations of NBMI: λz; Changes in Unified Multiple System Atrophy Rating Scale (UMSARS) individual scale from baseline in MSA patients compared to placebo treatment; Changes in QOL individual scores from baseline by MSA questionnaire in MSA patients; Changes in QOL individual scores from baseline by MSA questionnaire in MSA patients using Visual Analog score; Changes in QOL individual scores from baseline by EQ-5D score in PSP patients compared to placebo treatment; Changes in Parkinson's Disease Fatigue Score (PFS) score from Baseline - V1 to V2 (D29) and V1 to V5 (D57) in PSP and MSA patients compared to placebo treatment; Changes in Beck's Depression Inventory (BDI) scale (MSA patients) score from Baseline V1 to V2 (D29) and to V4 (D57) compared to placebo treatment; Changes in Geriatric depression scale (GDS) (PSP patients) score from Baseline - V1 to V2 (D29) and to V4 (D57) compared to placebo treatment; Frequency, type and severity of adverse events compared to placebo treatment .; Percentage of NBMI-treated patients who develop a response to NBMI.; Changes from baseline in brain metabolism as evaluated with Fluorodeoxyglucose Positron Emission Tomography (FDG PET) CT brain imaging compared to placebo treatment; Changes from baseline in brain iron levels as detected with Magnetic Resonance Imaging (MRI) imaging methods compared to placebo treatment; Pharmacokinetic parameters derived from plasma concentrations of NBMI: Maximum Plasma Concentration [Cmax]; Pharmacokinetic parameters derived from plasma concentrations of NBMI: AUC0-t; Pharmacokinetic parameters derived from plasma concentrations of NBMI: T max",,2019,2019; Recruiting,,,drug,
Droxidopa,NCT03446807,P2,"MSA, PD, PSP",32,Week 29,Efficacy of Droxidopa on fatigue in subjects with Parkinsonism as determined by completion of Visual Analogue Fatigue Scale (VAFS); Efficacy of Droxidopa on motor and non-motor symptoms of Parkinsonism as determined by the Unified Parkinson's Disease Rating Scale (UPDRS),,2018,2019; Not yet recruiting,,,drug,
"In-home technology, Limited in-home technology",NCT03828383,N/A,"AD, FTDLD",80,4 times over 9-month period (at time of installation and then every 3 m),Satisfaction with Life Scale; Zarit Burden Interview-Short Form; Center for Epidemiological Studies Depression Scale (CES-D); Beck Anxiety Inventory (BAI); Revised Functional Limitations Battery,,2019,2019; Recruiting,,,device,
Neuraceq,NCT04055532,,"DLB, PD, AD, ALS, FTDLD, MCI",0,2-5 Years,Performance on Batteries of Cognitive Tests,,2019,2019; Withdrawn,,,biom,
Combination of 40Hz light and cognitive therapy (ALZLIFE),NCT03657745,,"AD, MCI",2000,"through study completion, an average of 1 year",In-app cognitive test; Alzheimer's Disease Cooperative Study-activities of daily living (ADCS-ADL),,2018,2019; Recruiting,,,device,
social cognition,NCT03052712,N/A,"HD, AD, PD",44,3 years,tests of social cognition (questionnaire),,2017,2019; Terminated,,,behav,
F-18,NCT03625128,Early P1,"FTDLD, AD, PSP",36,YEAR ONE,The primary outcome measures are to evaluate the dosimetry of novel radiotracer 18F-PM-PBB3 in human.; Optimal scanning time for brain imaging using 18F-PM-PBB3 .,,2018,2019; Completed,,,biom,
Cognitive Training,NCT03656107,N/A,"MCI, AD",60,17 m,"Percentage of participants successfully recruited; Percentage of participants able to successfully complete the minimum (15 mins, 3x per week, for 8 weeks) and maximum (30 mins, 5x per week, for 12 weeks) criteria CT program and complete all assessments; Percentage of participants with full bilateral data for CBFv; Percentage of control participants willing to be randomised to waiting list control; Change in cognition score as detected by the Addenbrooke's cognitive examination (ACE-III); Change in functional status - Lawton Instrumental Activities of Daily Living (IADL); Change in mood - Geriatric Depression Scale (GDS-15); Change in quality of life measure - Dementia Quality of Life Measure (DEMQOL); Percentage increase in cerebral blood flow velocity (CBFv) from baseline; Semi-structured interview or focus group constructed around the health belief model to identify the barriers to CT in patients with dementia.; Semi-structured interview or focus group constructed around the health belief model to identify the facilitators to CT in dementia.; Semi-structured interview or focus group constructed around the health belief model to identify how CT programs can be adapted further to support the participation of patients with dementia.; Are there any additional benefits to CT programs not measured by traditional methods as perceived by the patients and their carers?; Semi-structured interview or focus group constructed around the health belief model, to identify the lived experience of the patient and their carer and the impact CT has on them and their life.",,2018,2019; Recruiting,,,behav,
11C-PBR28,NCT02702102,P2,"PD, DLB",5,1 year,Absolute 11C-PBR28 binding (total distribution volume corrected for free fraction in plasma); Relative 11C-PBR28 binding,,2016,2019; Completed,,,biom,
Boston Cognitive Assessment (BoCA),NCT04114994,,"MCI, FTDLD, AD, PD",10000,"through study completion, an average of 1 year",Boston Cognitive Assessment (BoCA),,2019,2019; Recruiting,,,device,
Brainsway H1-Coil Deep TMS System,NCT03665831,N/A,"MCI, AD",28,4 w,Change From Baseline on the Montgomery-Asberg Depression Rating Scale (MADRS); Remission Rates Compared Within Treatment Group; Response Rates Compared Within Treatment Group; Change From Baseline on the Quality of Life Enjoyment and Satisfaction Questionnaire (Q-LES-Q); Change From Baseline on the Neuropsychological Battery; Change in Functional Connectivity between PFC and Limbic Regions; Change in Perfusion within Prefrontal Cortex (PFC) and Posterior Cingulate Cortex (PCC); Change in frontal theta power within the Anterior Cingulate Cortex (ACC),,2018,2019; Recruiting,,,device,
Observational Cohort,NCT04104373,,"ALS, AD, PD, FTDLD",522,5 years,Eye Tracking - Pro Saccade and Anti Saccade; Retinal Nerve Imaging; Gait and Balance; Genomics; Neuropsychology; Neuroimaging,,2019,2019; Completed,,,delete,
RHAPSODY online program and MEET online sessions,NCT03923517,N/A,"AD, FTDLD",20,1 year,Acceptability and usefulness; Feasibility,,2019,2019; Completed,,,behav,
Nautilus NeuroWaveTM System,NCT02333942,,"FTDLD, MCI, AD",41,one year,Sensitivity as a diagnostic aid in detecting Dementia (identified signatures as compared with the clinical assessment made by the PI); Specificity as a diagnostic aid in detecting Dementia (Rate of false positives as compared with the clinical assessment made by the PI); Sensitivity and specificity measures for MCI and Alzheimer's disease (Efficacy and rate of false positives as compared with the clinical assessment made by the PI); Sensitivity and specificity measures between MCI and FTDL. (distinguish between MCI and FTDL using efficacy and rate of false positives from the identified signatures as compared with the clinical assessment made by the PI); Sensitivity and specificity measures between FTDL and Alzheimer's disease (distinguish between FTLD and Alzheimer's disease using efficacy and rate of false positives from the identified signatures as compared with the clinical assessment made by the PI),,2015,2019; Completed,,,device,
"Data-Driven Clinical Recommendations, Coached Data-Driven Clinical Recommendations",NCT04082611,N/A,"MCI, AD",60,1 year,NIH ToolBox Cognition Function Battery - Cognitive Function Composite Score; RAVLT (Rey's Auditory Verbal Learning Test) score; Hippocampal Volume; Blood Urine Nitrogen,,2019,2019; Recruiting,,,behav,
