Table 5.  devices in independent trials involving more than 1 neurodegenerative disorder.,,,,,,,,,,,,
,NCT03892382,N/A,ALS,0,"Baseline rTMS, four w after finishing rTMS","Apathy Evaluation Scale Clinical Version second follow up, total score, range 18 to 72 with higher values representing a worse outcome; Lateral Sclerosis Functional Rating Scale-Revised after rTMS, total score, range 0 to 40 with higher values representing a better outcome; Apathy Evaluation Scale Clinical Version after rTMS, total score, range 18 to 72 with higher values representing a worse outcome; Apathy Evaluation Scale Clinical Version first follow up, total score, range 18 to 72 with higher values representing a worse outcome; Lateral Sclerosis Functional Rating Scale-Revised first follow up, total score, range 0 to 40 with higher values representing a better outcome; Lateral Sclerosis Functional Rating Scale-Revised second follow up, total score, range 0 to 40 with higher values representing a better outcome; Beck's Depression Inventory ater rTMS, total score, range 0 to 63, with higher values representing a worse outcome; Beck's Depression Inventory first follow up, total score, range 0 to 63, with higher values representing a worse outcome; Beck's Depression Inventory second follow up, total score, range 0 to 63, with higher values representing a worse outcome",,2019,2020; Withdrawn,,,
,NCT04222218,N/A,"PD, PSP",20,Changes from Baseline to immediately after stimulation,"Short Physical Performance Battery, total time (SPPB); Timed up and Go tests, total time (TUG); Static Balance tests, total time; Tinetti Balance test (TBT); Static Balance- area of sway; PSP rating scale (PSP-RS); Static Balance: wearable sensor analyses - velocity; Static Balance: wearable sensor analyses - acceleration; Static Balance: wearable sensor analyses - jerk",,2020,2020; Completed,,,
,NCT02468804,N/A,PD,120,Change immediately after a single session TMS (pre will be done 1 week prior),Performance on working memory task (N-back task),,2015,"2019; Active, not recruiting",,,
,NCT02537496,N/A,AD,36,Change from baseline at 7 d and 6 m after intervention.,Change in N-back Task Performance; Changes in Theta Phase-Gamma Amplitude Coupling; Changes in DLPFC Neuroplasticity; Changes in Cognitive Function Measures Scores; Validating a new scale for insight in Alzheimer's disease.,,2015,2019; Completed,,,
,NCT03497884,N/A,PD,38,"through study completion, an average of 1 year",degree of enhanced neuro-activity associated with frequency-specific treatment,,2018,2018; Completed,,,
,NCT02850159,N/A,PD,32,"Assessed at T0, pre-NIBS at day 1 and T1, immediately after NIBS at day 5",Change of Freezing of Gait Questionnaire (FOG-Q),,2016,2017; Completed,,,
,NCT02190019,P4,MCI,14,8 w,Apathy Evaluation Scale (AES); Trials making test; Exit 25,,2014,2016; Unknown status,,,
,NCT01885806,P2,AD,40,"4th week, 8th week, 12th week",Change in apathy symptoms; Change in ADAS-Cog scores; Change in the Zarit Burden Scale; Safety assessment,,2013,2013; Unknown status,,,
RTMS,NCT03778151,N/A,AD,50,change from baseline to Week 24,Clinical Dementia Rating scale (CDR) sum of boxes; Alzheimer's Disease Assessment Scale Cognitive Subscale (ADAS-Cog); Alzheimer's Disease Cooperative Study - Activities of Daily Living (ADCS-ADL); Neuropsychiatric Inventory (NPI); Frontal Assessment Battery (FAB); Immediate and delayed total recall score from the Rey Auditory Verbal Learning test (RAVLT); Cortical activity (TMS-EEG),,2018,2021; Completed,,,
,NCT02621424,N/A,MCI,32,immediately following treatment and 4 m later,Changes in Animal Fluency After Treatment and 4 Months Later; Changes in BDNF Levels in Serum and/or CSF After Treatment and 4 Months Later; Changes in Boston Naming After Treatment:; Changes in Trail Making After Treatment and 4 Months Later; Changes From Baseline CVLT Scores After Treatment and 4 Months Later,,2015,"2020; Active, not recruiting",,,
Magnetic Resonance Imaging (MRI),NCT03699644,N/A,"FTDLD, AD",50,45 Minutes,Presence of Retinal Thinning; Presence of Amyloid Plaque; Presence of Brain Pathology; Presence of Brain Metabolism; Presence of Macular Vascular Anomalies,,2018,2021; Suspended,,,no
,NCT02816645,N/A,PD,160,at 1 year,Change from baseline activities of daily living; Change from baseline freezing; change from baseline cognitive function; Change from baseline cerebral R2*; Change from baseline Parkinson's disease clinical symptoms; Change from baseline severity of Parkinson's disease; Change from baseline hyper and hypo dopaminergic symptoms scores; Change from baseline sleepiness score; Change from baseline autonomic functions score; Change from baseline non-motor symptoms score; Change from baseline apathy score; Change from baseline depression score; Change from baseline anxiety score,,2016,2019; Recruiting,,,
,NCT03022357,,PD,145,12 m,"Presence or absence of ""swallow tail"" on nigrosome MRI at 3T",,2017,2018; Unknown status,,,
,NCT02843906,N/A,"MCI, AD",180,40 minutes,Functionnal/Cognitive evaluation; Psychatric evaluation; Brain MRI,,2016,2016; Unknown status,,,
,NCT02089555,,"MCI, AD",135,one time only,CSF endothelial marker levels; CSF Alzheimer's biomarker levels; MRI evidence of small vessel disease; MRI evidence of brain atrophy,,2014,2016; Completed,,,
,NCT00106899,,AD,818,,,,2005,2014; Completed,,,
transcranial Direct Current Stimulation (tDCS),NCT04504422,N/A,PD,24,Immediately after a 20-minute tDCS session,Cognitive dual-task interference (%) in Timed-up & go test; Physical dual-task interference (%) in Timed-up & go test; Timed-up & go test (sec): single task; Timed-up & go test (sec): cognitive dual-task; Timed-up & go test (sec): physical dual-task; Stroop test; Trail making test; Digit span test,,2020,2021; Recruiting,,,
,NCT02959502,N/A,"AD, MCI",40,Baseline to 8 w after baseline.,"Feasibility of training a facilitator (caregiver) to facilitate the administration of CR+tDCS to their ""patient"" partner as indicated by a positive response in the Perceived Competence Scale at 24 months from study baseline.; Assess change in Quality of Life Scale scores among patients between baseline and at the end of the 8-week course.; Measure the change in Quality of Life Scale scores among facilitators between baseline and at the end of the 8-week course.; Measure the change in cognition (as indicated by a change in the Sheehan Disability Scale) among patients between baseline and at the end of the 8-week course; Measure the change in cognition (as indicated by a change in the Sheehan Disability Scale) among facilitators between baseline and at the end of the 8-week course",,2016,2021; Recruiting,,,
,NCT02386670,N/A,MCI,375,"Approximately 4, 12, 24, 36, 48, 60 m after baseline",Change in cognitive scores over time; Percentage of subjects who remain free of MCI or dementia over time,,2015,"2020; Active, not recruiting",,,
,NCT02873546,N/A,AD,52,"baseline, day 5 and 3 w post-tDCS",change from baseline cognitive functions at 3 weeks,,2016,2017; Unknown status,,,
MRI scan,NCT02664571,N/A,AD,0,Day 0,PET scan with Florbetaben: Standardized Uptake Value Ratio; On the reference MRI: the number of lobar hemorrhages; On the reference MRI: the locations of lobar hemorrhages; On the reference MRI: The presence/absence classification for superficial siderosis; On the reference MRI: the locations of superficial siderosis; On the reference MRI: the absolute quantitative count of microbleeds; On the reference MRI: microbleed count category; On the reference MRI: The predominant location of microbleeds; On the reference MRI: a measure of leukoencephalopathy using the ARWMC scale; Apolipoprotein E genotype,,2016,2021; Withdrawn,,,no
,NCT04228172,,PD,32,Baseline and 18 m later,Increase in PD related metabolic pattern expression; Increase in PD related functional pattern expression; Change in motor function; Change in cognitive function,,2020,2020; Recruiting,,,
Sham tDCS,NCT03325205,N/A,AD,19,4 m,Performance on Neuropsychological tests; Hippocampal volume,,2017,2021; Completed,,,
,NCT02596906,N/A,MCI,22,Two longitudinal measurements at baseline and 1-month,Regional Brain Blood Flow Change Immediately After 1 Month of Cognitive Training and tDCS Brain Stimulation; Change From Baseline in California Verbal Learning Task Score,,2015,2021; Completed,,,
,NCT04457973,N/A,AD,40,end of intervention (day 5),"Pain as assessed by the Mobilization-Observation-BehaviorIntensity-Dementia (MOBID-2) scale; Clinical pain as assessed by a numerical rating scale (NRS); Behavioral and psychological symptoms of dementia (BPSD) as measured by Agitation as measured by the Cohen-Mansfield Agitation Inventory (CMAI); Behavioral and psychological symptoms as assessed by neuropsychiatric inventory (NPI); Change in pain related cortical response using a continuous wave, multichannel Functional near-infrared spectroscopy (fNIRS) imaging system; Acceptability as measured by the tDCs experience questionnaire; Patient satisfaction as measured by the Client Satisfaction Questionnaire (CSQ)",,2020,2020; Recruiting,,,
,NCT03189472,N/A,PD,31,5 Weeks,Number of participants having completed 80% sessions,,2017,2020; Completed,,,
,NCT02940457,N/A,MCI,0,4 w,"Brain activation measured with NIRS; Reaction times, errors and number of generated words in neuropsychological tasks; T1 weighted magnetic resonance Imaging (MRI) of the brain; Blood sampling",,2016,2020; Withdrawn,,,
,NCT04046055,N/A,PD,7,"Through study completion, up to 6 m","Time to complete the fast 30 meter walk test; Distance walked in the 6 Minute Walk Test; Time to complete the Timed Up and Go test; Movement of the center of pressure (2D; forward-backward, left-right) while standing on a firm surface (force platform) for 1 minute; Movement of the center of pressure (2D; forward-backward, left-right) while standing on a foam surface (6 cm foam pad placed on top of force platform) for 1 minute; Movement of the center of pressure (1D; forward-backward) while standing on a firm surface for 1 minute; Movement of the center of pressure (1D; forward-backward) while standing on a foam surface for 1 minute; Movement of the center of pressure (1D; left-right) while standing on a firm surface for 1 minute; Movement of the center of pressure (1D; left-right) while standing on a foam surface for 1 minute",,2019,2020; Completed,,,
,NCT03670615,N/A,"AD, MCI",30,Change over 2 w (Midpoint to Endpoint),Change in global cognitive function: The Montreal Cognitive Assessment (MoCA) Total Scores; Changes in concentration of blood biomarkers of brain plasticity; Change in neuropsychiatric symptoms: The Neuropsychiatric Inventory (NPI); Change in cognition: n-back reaction time; Change in cognition: n-back accuracy; Change in cognition: The Word Recall Task from the Alzheimer's Disease Assessment Scale-Cog (ADAS-Cog); Change in cognition: The Word Recognition Task from the Alzheimer's Disease Assessment Scale Cog (ADAS-Cog),,2018,2020; Recruiting,,,
,NCT02656316,N/A,PD,85,short (two w) after treatment and long term following (11 w) after treatment,Changes in frequency and severity of the freezing of gait phenomenon; Changes in cognitive performance; Immediate change in gait mesurments,,2016,"2019; Active, not recruiting",,,
,NCT02315781,N/A,PD,3,12 w,HAMD score; Dopamine levels,,2014,2018; Terminated,,,
,NCT02587338,N/A,MCI,50,4 w,Neuropsychological performance in neuropsychological tests; Brain activation measured with NIRS,,2015,2018; Completed,,,
,NCT03313518,N/A,AD,30,ten d,"Change in measurement of improvement in cognitive function by using MMSE; Change in measurement of improvement in cognitive function by cornell Scale; The change of measurement of brain damage biomarkers modulation in plasma (i.e. Tau, Beta-Amyloid, Lipid Peroxidation) cornell Scale",,2017,2017; Completed,,,
,NCT02503930,N/A,PD,60,One week post intervention,Changes in frequency and severity of the freezing of gait phenomenon; fMRI scans - changes in gray matter (GM) volume; fNIRS related frontal lobe activation - changes in tissue oxygenation; Changes in cognitive performance; Immediate change in gait speed; Immediate change in gait variability,,2015,2015; Unknown status,,,
,NCT02205216,N/A,PD,40,"from baseline to follow-up periods (immediately, 1 and 3 m after the last intervention)",Walking parcours; New Freezing of Gait Questionnaire (N-FOGQ); Movement Disorders Society-Unified Parkinson's Disease Rating Scale (MDS-UPDRS); 39-Item Parkinson's Disease Questionnaire (PDQ-39); Beck Depression Inventory (BDI); 10 Meter Walk Test (10MWT); Timed Up & GO (TUG),,2014,2015; Unknown status,,,
,NCT02125383,N/A,PD,9,During each sleep study,PD motor scores measured by Kinesia HomeView; Sleepiness; tDCS sensations; Motor scores measured by the Unified Parkinson's Disease Rating Scale; Overnight Polysomnography,,2014,2015; Completed,,,
Anodal tDCS,NCT03325205,N/A,AD,19,4 m,Performance on Neuropsychological tests; Hippocampal volume,,2017,2021; Completed,,,
,NCT03638531,P2,PD,40,"Baseline, 1 day post, 2 w post, 4 w post",Force error in the precision grip task; Handwriting task performance; Transfer of motor learning,,2018,2018; Unknown status,,,
SHAM,NCT04251728,N/A,PD,40,12 w,Timed up and go; Heart rate variability; Peak oxygen uptake; Oxygen uptake at the ventilatory anaerobic threshold; 24-h blood pressure; Sleep quality,,2020,2021; Recruiting,,,
,NCT01782391,N/A,MCI,22,4 w,"Retention of declarative memories after 0.75 Hz stimulation during SWS, vs after sham stimulation during SWS; Amount of Slow wave Sleep, spindels, eeg-correlates, further memory systems",,2013,2016; Unknown status,,,
sham,NCT02621424,N/A,MCI,32,immediately following treatment and 4 m later,Changes in Animal Fluency After Treatment and 4 Months Later; Changes in BDNF Levels in Serum and/or CSF After Treatment and 4 Months Later; Changes in Boston Naming After Treatment:; Changes in Trail Making After Treatment and 4 Months Later; Changes From Baseline CVLT Scores After Treatment and 4 Months Later,,2015,"2020; Active, not recruiting",,,
,NCT02417415,N/A,MSA,21,1 hour and 2 hours of heat stress or when Tcore increases 1ºC,Systolic blood pressure; Hemodynamic measures,,2015,2020; Enrolling by invitation,,,
,NCT02657681,P2,PD,50,"Baseline, one day and one week after the end of treatment","Change from baseline of the maximal dyskinesia severity within 90min after levodopa intake, as measured by objective evaluation with the Unified Dyskinesia Rating Scale (UDysRS) one day after the end of treatment.; Change from baseline of the maximal dyskinesia severity within 90min after levodopa intake, as measured by objective evaluation with the Unified Dyskinesia Rating Scale (UDysRS) one week after the end of treatment.; Dyskinesia severity evaluated for each body segment; Subjective evaluation of the treatment, as measured by the patient global impression of change (PGIC); Change from baseline in motor symptoms, as measured by the MDS-UDPRS III scale",,2016,2018; Completed,,,
,NCT01825330,N/A,AD,131,12 w,Efficacy; Safety,,2013,2016; Completed,,,
Active tDCS,NCT04655079,N/A,PSP,24,Baseline (T0); At 3-month (T3),Change from baseline to 3-month follow up in verbal fluency task; Change from baseline to 3-month follow in motor symptoms as assessed with sensor recordings (OPAL system); Change from baseline to 3-month follow up in cognitive symptoms as assessed with cognitive evaluation; Change from baseline to 3-month follow up in caregiver distress as assessed with behavioural evaluation,,2020,2020; Not yet recruiting,,,
,NCT04457973,N/A,AD,40,end of intervention (day 5),"Pain as assessed by the Mobilization-Observation-BehaviorIntensity-Dementia (MOBID-2) scale; Clinical pain as assessed by a numerical rating scale (NRS); Behavioral and psychological symptoms of dementia (BPSD) as measured by Agitation as measured by the Cohen-Mansfield Agitation Inventory (CMAI); Behavioral and psychological symptoms as assessed by neuropsychiatric inventory (NPI); Change in pain related cortical response using a continuous wave, multichannel Functional near-infrared spectroscopy (fNIRS) imaging system; Acceptability as measured by the tDCs experience questionnaire; Patient satisfaction as measured by the Client Satisfaction Questionnaire (CSQ)",,2020,2020; Recruiting,,,
,NCT03189472,N/A,PD,31,5 Weeks,Number of participants having completed 80% sessions,,2017,2020; Completed,,,
,NCT02656316,N/A,PD,85,short (two w) after treatment and long term following (11 w) after treatment,Changes in frequency and severity of the freezing of gait phenomenon; Changes in cognitive performance; Immediate change in gait mesurments,,2016,"2019; Active, not recruiting",,,
,NCT02503930,N/A,PD,60,One week post intervention,Changes in frequency and severity of the freezing of gait phenomenon; fMRI scans - changes in gray matter (GM) volume; fNIRS related frontal lobe activation - changes in tissue oxygenation; Changes in cognitive performance; Immediate change in gait speed; Immediate change in gait variability,,2015,2015; Unknown status,,,
,NCT02205216,N/A,PD,40,"from baseline to follow-up periods (immediately, 1 and 3 m after the last intervention)",Walking parcours; New Freezing of Gait Questionnaire (N-FOGQ); Movement Disorders Society-Unified Parkinson's Disease Rating Scale (MDS-UPDRS); 39-Item Parkinson's Disease Questionnaire (PDQ-39); Beck Depression Inventory (BDI); 10 Meter Walk Test (10MWT); Timed Up & GO (TUG),,2014,2015; Unknown status,,,
,NCT02125383,N/A,PD,9,During each sleep study,PD motor scores measured by Kinesia HomeView; Sleepiness; tDCS sensations; Motor scores measured by the Unified Parkinson's Disease Rating Scale; Overnight Polysomnography,,2014,2015; Completed,,,
Sham stimulation,NCT04589182,N/A,"HD, MCI, PD",12,"before and after intervention (day 1 and 4, day 7 and 10)",Subjective sleep quality; Pilot study: feasibility of acoustic SWS enhancement; Vigilance; Sleep benefit on motor performance; Momentary sleepiness; Average sleepiness; Mood; Restorative effect of sleep; Slow wave enhancement; Auditory stimulation algorithm performance; Pilot study: changes in mood; Pilot study: changes in sleep quality; Pilot study: changes in sleepiness,,2020,2020; Recruiting,,,
,NCT03217110,N/A,PD,200,During the 1 week of treatment comparing pre- and post-stimulation scans.,"Schizophrenia group: Change in Calgary depression scale.; Bipolar group: Change in Young Mania Rating Scale.; Change in cognitive function.; Change in disease-specific symptom rating scale, one scale identified for each group (MADRS for bipolar group; PANSS for schizophrenia group; UPDRS in Parkinson's patient group).; Change in brain rhythms; Change in cognitive function; Changes in functional MRI; Change in NIH Toolbox emotion battery; Change in motor function; Bipolar group: Change in Columbia Suicide Severity Rating Scale.; Change in PHQ9 score.; Change in CGI.; Changes in structural MRI.; Changes in MRI-based timing task.; Changes in DTI.; Changes in T1 rho MRI signal.",,2017,2020; Recruiting,,,
,NCT03359902,N/A,MCI,250,5-10 minutes,Rey AVLT,,2017,2020; Recruiting,,,
,NCT02931097,P1/P2,PD,12,"3, 5, 7 m after surgery",Change in the anticipatory postural adjustments between each deep brain stimulation condition,,2016,2019; Recruiting,,,
,NCT01569958,P2,ALS,54,12 m,Decline of ALSFRS-R (ALS functional rating scale-revised) from baseline to 12 months; Decline of muscle strength from baseline to 12 months; Change of upper motor neuron signs from baseline to 12 months; Decline of forced vital capacity (percent of predicted normal) from baseline to 12 months; Change of quality of life from baseline to 12 months,,2012,2012; Unknown status,,,
Focused Ultrasound,NCT01772693,N/A,PD,27,Month 3,Number of Adverse Events; Functional Disabilities - Clinical Rating Scale for Tremor Part C - Functional Disabilities; Tremor Motor Scores - Clinical Rating Scale for Tremor - Treated Side Upper Extremity Parts A & B.; Tremor Motor Score Percent Change From Baseline.,,2013,2020; Completed,,,
,NCT02246374,N/A,PD,7,Baseline to 12-m post treatment,Incidence and severity of adverse events; Mean change in MDS-UPDRS Part III scores; Long Term Adverse Events Profile; Mean change in MDS-UPDRS total score; Mean change in MDS-UPDRS Part IV scores,,2014,"2020; Active, not recruiting",,,
,NCT02252380,N/A,"HD, PD",10,At the time of ExAblate procedure,Severity of Device and Procedure Related Complications,,2014,"2020; Active, not recruiting",,,
,NCT02263885,N/A,PD,20,At the time of Exablate transcranial procedure,Severity of Device and Procedure related complications,,2014,"2020; Active, not recruiting",,,
rTMS treatment,NCT04490616,N/A,MCI,32,"athrough study completion, an average of 12 w",Comparison of Deceptive Box Task score; Comparison of Look-prediction/say-prediction test score; Comparison of Empathy Quotient score; Comparison of Ekman 60 test score; Comparison of Frontal Behavioral Inventory score; Comparison of Look-prediction/say-prediction test; Changes from baseline in Deceptive Box Task Test.; Changes from baseline in Look/say Test; Changes from baseline in Empathy Quotient scale; Changes from baseline in Ekman 60 Test; Changes from baseline in Frontal Behavioral Inventory; Comparison Montreal Cognitive Assessment; Comparison of Geriatric Depression Scale score; Comparison of Euroquol-5 dimensions score,,2020,2020; Not yet recruiting,,,
,NCT02221544,N/A,PD,20,One week post intervention,Changes in frequency and severity of the freezing of gait phenomenon; Community ambulation; Changes in endurance; Balance; Immediate changes in blood pressure; Immediate change in gait function,,2014,2014; Unknown status,,,
Sham transcranial direct current stimulation,NCT04046055,N/A,PD,7,"Through study completion, up to 6 m","Time to complete the fast 30 meter walk test; Distance walked in the 6 Minute Walk Test; Time to complete the Timed Up and Go test; Movement of the center of pressure (2D; forward-backward, left-right) while standing on a firm surface (force platform) for 1 minute; Movement of the center of pressure (2D; forward-backward, left-right) while standing on a foam surface (6 cm foam pad placed on top of force platform) for 1 minute; Movement of the center of pressure (1D; forward-backward) while standing on a firm surface for 1 minute; Movement of the center of pressure (1D; forward-backward) while standing on a foam surface for 1 minute; Movement of the center of pressure (1D; left-right) while standing on a firm surface for 1 minute; Movement of the center of pressure (1D; left-right) while standing on a foam surface for 1 minute",,2019,2020; Completed,,,
,NCT02999282,N/A,FTDLD,70,Baseline - 2 w - 3 m - 6 m,Change in SICI measurements from Baseline; Change in ICF measurements from Baseline; Change in LICI measurements from Baseline; Change in SICF measurements from Baseline; Change in MMSE scores from Baseline; Change in phonemic fluencies scores from Baseline; Change in semantic fluencies scores from Baseline; Change in digit span forward scores from Baseline; Change in digit span backward scores from Baseline; Change in camel and cactus test scores from Baseline; Change in TMTA scores from Baseline; Change in TMTB scores from Baseline; Change in Stroop test scores from Baseline; Change in Symbol Digit test scores from Baseline; Change in Block Design test scores from Baseline; Change in The modified EkmanFaces Test from Baseline,,2016,2020; Completed,,,
active tDCS,NCT02315781,N/A,PD,3,12 w,HAMD score; Dopamine levels,,2014,2018; Terminated,,,
,NCT02997007,N/A,MCI,80,5-12 d,neural changes after multi-session tDCS; network changes after multi-session tDCS; Task performance changes after multi-session tDCS,,2016,2018; Unknown status,,,
,NCT02917122,P1/P2,PD,40,week 0 and 6,Change of Unified Parkinson's Disease Rating Scale among different weeks; Change of Hoehn and Yahr scale among different weeks; Change of Hamilton Rating Scale for Depression among different weeks; Change of Taiwanese Depression Questionnaire among different weeks; Change of Global Assessment of Functioning among different weeks; Change of clinical global impression among different weeks; Change of finger tapping test among different weeks; Change of continuous performance task among different weeks; Change of Wisconsin Card Sorting Test among different weeks; Change of Wechsler Memory Scale - Revised among different weeks,,2016,2016; Unknown status,,,
,NCT02772185,P2/P3,AD,60,"From date of first neurostimulation until the date of last neurostimulation, assessed up to 12 m",Change in cognitive ability assessed on the Wechsler Adult Intelligence Scale; Change in visuo-spatial working memory assessed on the Corsi block task; Change in cognitive function assessed on the Alzheimer's Disease Assessment Scale-cognitive subscale (ADAS-Cog); Change in verbal working memory assessed on the Digit Span task; Change in speed of cognitive processing and executive functioning assessed on the Trail Making Test; Change in executive function assessed on the Stroop Color and Word Test; Change in verbal fluency assessed on the FAS Verbal Fluency Test; Change in functional ability assessed on the Disability Assessment Dementia; Change in visual recognition assessed on the Poppelreuter-Ghent's Overlapping Figures test; Change in behavioral and psychological disturbances assessed on the Neuropsychiatric Inventory Questionnaire; Change in subjective burden among caregivers assessed on the Zarit Burden Interview; Change in electrical activity of the brain assessed on the Electroencephalogram (EEG); Side Effects Questionnaire,,2016,2016; Unknown status,,,
sham tDCS,NCT02997007,N/A,MCI,80,5-12 d,neural changes after multi-session tDCS; network changes after multi-session tDCS; Task performance changes after multi-session tDCS,,2016,2018; Unknown status,,,
