Table 5.  devices in independent trials involving more than 1 neurodegenerative disorder.,,,,,,,,,,,,
,NCT02480803,P4,PD,66,"12, 24 and 36 m","Cost effectiveness in costs per unit on PDQ-39; Cost-utility in costs per QALY; Change from Baseline in quality of life: changes on PDQ-39 at 12 months; Change from Baseline in quality of life: changes on EQ-5D; Change from Baseline in motor symptoms: score changes in off and on state on MDS-UPDRS; Change from Baseline in motor symptoms: changes in off-state, on-state without dyskinesias, on-state without troublesome dyskinesias and on-state with troublesome dyskinesias; Change from Baseline in motor symptoms: changes on clinical Dyskinesia Rating Scale; Change from Baseline in non-motor symptoms: changes on Non Motor Symptom Checklist; Change from Baseline in non-motor symptoms: changes on Rotterdam Symptom Checklist; Change from Baseline in non-motor symptoms: changes on SCOPA-AUT; Change from Baseline in non-motor symptoms: changes on MDS-UPDRS part 2; Number of participants with adverse effects and description of adverse effects at 12 months; Number of participants with complications and description of complications at 12 months; Number of participants with treatment failure at 12 months; Number of participants who stopped treatment at 12 months; Number of participants with treatment cross-over at 12 months; Change from Baseline in PD-medication (levodopa-equivalent dose) at 12 months; Change from Baseline in disability: change of Hoehn and Yahr stage; Change from Baseline in functional health status: changes on AMC Linear Disability Score); Change from Baseline in patient satisfaction (questionnaire); Change from Baseline in patients attitude to treatment on PRO-Likert Scale; Change from Baseline in cognition: changes on Mattis Dementia Rating Score; Change from Baseline in cognition: changes on PD-CRS; Change from Baseline in language: changes on Boston Naming Test; Change from Baseline in language: changes on letter fluency test; Change from Baseline in intelligence: changes on WAIS IV; Change from Baseline in intelligence: changes on Dutch Reading test for Adults; Change from Baseline in memory: changes on 15 word test; Change from Baseline in memory: changes on Rivermead Behavioral Memory Test; Change from Baseline in attention and executive functions: changes on trail making test; Change from Baseline in attention and executive functions: changes on Stroop test; Change from Baseline in complex visual perception: changes in judgement of line orientation; Change from Baseline in constructive skills: changes in ability to draw a Clock drawing; Change from Baseline in psychiatric disease: changes in psychiatric examination; Change from Baseline in psychiatric disease: changes on MINI; Change from Baseline in psychiatric disease: changes on Columbia Suicide Severity Rating Scale; Change from Baseline in psychiatric disease: changes on Hamilton Anxiety Scale; Change from Baseline in psychiatric disease: changes on Hamilton Depression Scale; Medical and non-medical care costs; Change from Baseline in caregiver burden; Change from Baseline in Compulsive Disorders (Parkinson's Disease Impulsive-Compulsive Disorders Questionnaire (QUIP); Change from Baseline in apathy (Starkstein's Apathy Scale)",,2015,2019; Recruiting,,,
,NCT02548897,N/A,PD,5,up to m 24 post DBS surgery,Number of freezing of gait events,,2015,2017; Completed,,,
,NCT02401308,N/A,PD,1,6 m post-operatively,Functional outcomes; Neurocognitive Function; Quality of life,,2015,2017; Terminated,,,
,NCT00053625,P3,PD,123,Baseline to 6 m,Mean change in total UPDRS score (baseline to six-months post DBS surgery); Mean change in UPDRS subscales and individual scores,,2003,2015; Completed,,,
,NCT02154724,N/A,PD,20,up to 1 year,Percentage of improvement in unified parkindon's disease rating scale (UPDRS score) of aDSB compare to cDBS; Number of participants with adverse events,,2014,2014; Unknown status,,,
,NCT01274832,,PD,40,after 3 and12 m of stimulation,percentage of improvement in motor aspects; Neuropsychological aspects; Psychiatrical aspects; Quality of Life; Medication intake,,2011,2011; Unknown status,,,
MRI,NCT02752750,,AD,50,2 years,Quantitative magnetic susceptibility (QSM) in the human brain,,2016,2021; Enrolling by invitation,,,no
,NCT02789020,P2,PD,96,Changes from baseline to 1 year,"Change in free-water accumulation in the substantia nigra; Change in blood oxygen level-dependent(BOLD) signal in the posterior putamen, M1, and supplementary motor area(SMA).; Changes in PD motor symptoms and bradykinesia; Changes between the groups on MRI for free-water in the substantia nigra; Changes between the groups on fMRI",,2016,"2021; Active, not recruiting",,,
,NCT04690998,N/A,ALS,100,Change from Baseline at 24 m,Clinical examination; VAS; Fatigue Severity Scale (FSS); Muscle strength; Timed test; Pulmonary function test; Quality of Life of patients; Blood samples; MRI,,2020,2020; Not yet recruiting,,,
,NCT02405182,,ALS,145,30 m,Change in neuronal and white matter integrity measures.; Correlation of neuronal and white matter integrity measures with clinical indices.,,2015,2020; Completed,,,
,NCT04653688,N/A,PD,150,at baseline at 48 w,"PKG changes at 48 weeks versus baseline; Changes of 95th percentile of home gait velocity (assessed during 10 days with FeetMe® Insoles) at 48 weeks versus baseline in Parkinsonian syndrome patient subgroups and in a control group.; Changes of 95th percentile of home gait velocity (assessed during 10 days with FeetMe® Insoles) at 12 weeks (MSA subgroup only) and 24 weeks versus baseline in Parkinsonian syndrome patient subgroups; Changes of 95th percentile of home gait cadence, stride length, stride, stance and swing durations (assessed during 10 days with FeetMe® Insoles) at 12 weeks (MSA subgroup only), 24 and 48 weeks versus baseline; Changes of UMSARS I-II versus baseline in MSA subgroup; Changes of MSA-QoL versus baseline in MSA subgroup; Changes of OHQ versus baseline in MSA subgroup; Changes of OHSA versus baseline in MSA subgroup; Changes of BBS versus baseline in MSA subgroup; Changes of Modified SE-ADL versus baseline in MSA subgroup; Changes of PDSS-2 versus baseline in MSA subgroup; Changes of COMPASS31 versus baseline in MSA subgroup; Changes of MOCA versus baseline in MSA subgroup; MRI changes at 24 and 48 weeks versus baseline.; DAT-scan changes at 48 weeks versus baseline.",,2020,2020; Not yet recruiting,,,
,NCT04212637,N/A,PD,80,1 hour,MRI images; Eye latency; eye amplitude,,2019,2020; Not yet recruiting,,,
,NCT03860857,P3,AD,200,Years 4 and 5 of the grant,Change in perforant path integrity; Change in tau spatial distribution - advancing Braak stage; Change in Clinical Dementia Rating - Sum of Box Score; Change in lure discrimination index - objects; Change in lure discrimination index - spatial; Change in lure discrimination index - temporal; Change in entorhinal cortical thickness,,2019,2020; Recruiting,,,
,NCT02134561,N/A,HD,24,"3 m before diagnostic (baseline) ; 2 years after diagnostic,",Change from baseline total score of the psychological Unified Huntington's Disease Rating Scale at 2 years,,2014,2020; Completed,,,
,NCT02550275,N/A,HD,44,3 m after inclusion,the achievement of social cognition process in Huntington's disease using the total score of the scale 15-TOM,,2015,2020; Completed,,,
,NCT02759887,N/A,AD,19,"Year 1, Year 2-3",Florbetapir PET - change between timeframes; tau PET - change between timeframes; FDG PET - change between timeframes; MRI - change between timeframes; dried blood spot collection (DBSC) analysis - change between timeframes,,2016,2019; Completed,,,
,NCT03288909,,PD,18,3 years,Quantitative signal analysis of nigrosome 1; Change in quantitative signal analysis of nigrosome 1,,2017,2019; Recruiting,,,
,NCT03272230,N/A,"FTDLD, PD",135,At day 1,NART; BREF (FAB english); HAYLING; HAD; Gray matter volume; White matter volume; Cerebral Spinal Fluid volume; Leptin; Adiponectin; Insulin; C-Peptide; FPG; HbA1C; K+; Uric acid; Creatinine; Total Protein; CRP; AST; ALT; GGT; Cholesterol; Triglycerides; EBI; ACDD; Brain lesion localization; IL-6; Pupil Diameter y; ICM_APATHY_TASKS; MMSE; DAS; STARKSTEIN (SAS); MATTIS; MADRS; Occurrence of each behavior from the ethogram; Frequency of each behavior from the ethogram; Duration of each behavior from the ethogram; Number of different behaviors; Activity classes; Body positions; Energy expenditure; MET; Steps; Acceleration intensity; Pupil Diameter x; HDL cholesterol; LDL cholesterol; Glycerol; FFAs; TSH; QUIP; BIS-11; Mini-SEA; STROOP; ECMP; QUIP-RS,,2017,2019; Recruiting,,,
,NCT02185677,,MSA,40,During 7 d after inclusion,"Behavioral Dysexecutive Syndrome Inventory scores; To compare the subscores of the BDSI between MSA-P patients and MSA-C patients.; To compare the cognitive tests exploring the cognitive dysexecutive syndrome between MSA-P patients and MSA-C patients.; To research correlations between scores UMSARS and cognitive and behavioral scores for MSA-P patients and MSA-C patients.; To compare atrophied brain areas, the anatomic and functional abnormalities of neural networks between MSA-P patients and MSA-C patients.; To research correlations between imaging abnormalities and cognitive test performance in MSA patients.; Actigraphy",,2014,2019; Completed,,,
,NCT03711825,Early P1,AD,8,"Through study completion, up to 29 d",Gastric retention by imaging assessment by MRI; Gastric retention by imaging assessment by abdominal U/S; Safety and tolerability of a single dose of LYN-057 extended release capsule; Memantine HCl pharmacokinetics - Maximum Plasma Concentration (Cmax); Memantine HCl pharmacokinetics - Time after administration of maximum plasma concentration (Tmax); Memantine HCl pharmacokinetics - Area Under the Curve (AUC); Physical features of recovered formulation components,,2018,2019; Completed,,,
,NCT03641768,N/A,AD,0,Baseline,Cortical thickness as measured by MRI scans; Beta amyloid plaques as measured by PET scans; Tau proteins as measured by PET scans,,2018,2018; Withdrawn,,,
,NCT02058732,N/A,ALS,6,5 years,Changes in spinal cord metabolites in treated ALS subjects and nontreated ALS subjects.,,2014,2018; Terminated,,,
,NCT02000713,N/A,ALS,20,3 years,Study levels of N-acetylaspartate (NAA)in the cervical spinal cord.; Fractional anisotropy in the cervical spinal cord,,2013,2018; Terminated,,,
,NCT02453763,,"AD, PD",17,Day 1,Magnetic Resonance Imaging (MRI) of therapeutic current flow,,2015,2018; Completed,,,
,NCT03275363,,"MCI, AD",500,1 year,Cognitive decline; Functional decline; Neuropsychiatric decline; Quality of life decline; Change in cognitive impairment status,,2017,2017; Recruiting,,,
,NCT02796040,N/A,PD,75,1 day,"Fractional anisotropy (data of diffusion tensor imaging, a technique of MRI); Fractional anisotropy in préfrontal cortex; Volume of ventral tegmental area; Number of fibers between ventral tegmental area and other structures of the reward system",,2016,2016; Unknown status,,,
,NCT01325259,P2,"AD, MCI",54,inclusion,Standard Uptake Value Ratios (SUVr),,2011,2016; Completed,,,
,NCT00987090,N/A,AD,240,3 years,"to establish the impact of age on the clinical and neuroimaging picture of sporadic Alzheimer Disease in a multicentric setting.; to describe for each age group, and in particular for the younger patient group, the functional impact of disability in everyday life on both, patients and caregivers.",,2009,2015; Unknown status,,,
,NCT00757939,P1,AD,40,"1 week, 6 and 12 m","Regional cerebral blood flow, as measured by dASL.; Rate of cerebral glucose consumption, MRglc, as measured by fludeoxyglucose-PET (FDG-PET); Resting state functional MRI blood-oxygen-level-dependent (fMRI BOLD) response",,2008,2015; Completed,,,
,NCT02319382,N/A,PD,46,Inclusion visit,Accumulation of [18F]DPA-714 in the midbrain assessed through PET,,2014,2015; Unknown status,,,
,NCT01993628,N/A,AD,80,At inclusion,Score obtained at the Rey figure test with a planning strategy help by LBD patients compared to the score obtained by AD patients.,,2013,2013; Unknown status,,,
,NCT01876459,N/A,AD,265,Day one.,rate of alpha-synuclein in cerebrospinal fluid,,2013,2013; Unknown status,,,
Sham Transcranial Magnetic Stimulation,NCT02420522,P2,MCI,64,Three w,Cognitive changes,,2015,2021; Suspended,,,
,NCT03121066,N/A,AD,45,3 d after the end of the treatment,Change in Cognitive improvement; Functional capacity changes; Mood changes; Changes in brain connectivity,,2017,2019; Not yet recruiting,,,
Sham,NCT04360044,P2,CBD,120,24 hours and 48 hours,Headache Pain Relief at 2 Hours Post-Treatment; Headache pain freedom; Most bothersome symptom freedom; Headache pain relief; Freedom from photophobia; Freedom from phonophobia; Use of rescue medication; Sustained pain freedom; Sustained most bothersome symptom freedom,,2020,2021; Recruiting,,,
,NCT04762823,N/A,PD,48,"Through study completion, up to 12 m","Movement Disorder Society version of the Unified Parkinson's Disease Rating Scale (MDS-UPRDS); Fatigue Severity Scale (FSS); Multidimensional Fatigue Inventory (MFI); 30-meter walk test, single-task (30mWT-ST; 2 trials); 30-meter walk test, dual-task (30mWT-DT; 2 trials); 6-minute walk test (6MWT; 1 trial); 9-hole peg test (9-HPT; two trials with each hand); Reaction time test (simple and choice; 1 trial each); Flanker Inhibitory Control and Attention Test (1 trial); Trail Making Test A and B (TMT A/B; 1 trial each); Berg Balance Scale (BBS); Static Posturography.; Brain activity PET Imaging with [18F]Fluorodeoxyglucose (FDG)",,2021,2021; Not yet recruiting,,,
,NCT03875326,N/A,"MCI, AD",240,"After each HD-tDCS Session, daily",Change in Lateral Temporal Cortex Connectivity; Self-Report of Contentment with Memory; Self-Report of Memory Mistakes; Self-Report of Memory Strategies Used; Change in Memory Functioning; Change in Overall Fluid Cognitive Abilities; Cumulative Working Memory Effects of HD-tDCS across daily sessions; Cumulative Memory Accuracy Effects of HD-tDCS across daily sessions; Cumulative Memory Reaction Time Effects of HD-tDCS across daily sessions; Tolerability of HD-tDCS; Effectiveness of Blinding of HD-tDCS; Change in Default Mode Network Connectivity; Change in Inhibition Ability; Change in Conceptualization Ability; Change in Picture Sequence Memory; Change in Working Memory Ability; Change in Processing Speed; Cumulative Working Memory Performance Effects of HD-tDCS across daily sessions; Change in Global Cognition; Change in Visuospatial Functioning; Change in Language Functioning; Change in Attention; Change in Cognitive Functioning; Cumulative Cognitive Change across Daily Consecutive Sessions,,2019,2020; Recruiting,,,
,NCT04589182,N/A,"HD, MCI, PD",12,"before and after intervention (day 1 and 4, day 7 and 10)",Subjective sleep quality; Pilot study: feasibility of acoustic SWS enhancement; Vigilance; Sleep benefit on motor performance; Momentary sleepiness; Average sleepiness; Mood; Restorative effect of sleep; Slow wave enhancement; Auditory stimulation algorithm performance; Pilot study: changes in mood; Pilot study: changes in sleep quality; Pilot study: changes in sleepiness,,2020,2020; Recruiting,,,
,NCT03446508,N/A,MCI,60,"Baseline (before the first HD-tDCS session), immediate post (immediately after the last HD-tDCS session) and 1 month follow up (1 month after the last HD-tDCS session)",Memory retrieval/word finding assessment.; Electroencephalography (EEG).,,2018,"2020; Active, not recruiting",,,
,NCT03328195,N/A,AD,60,12 w,Change in the Severe Impairment Battery (SIB) score - An assessment of Severe Dementia in the elderly.; Device safety according to the number of device-related adverse events; Change in the Severe Impairment Battery score - An assessment of Severe Dementia in the elderly.; Change in the Alzheimer's Disease Cooperative Study - Activities of Daily Living for Severe Alzheimer's Disease (ADL SAD) score; Change in the Neuropsychiatric Inventory (NPI) score which assesses behavioral changes in neurologic illnesses based on a standardized caregiver interview.; Change in the Alzheimer's Disease Cooperative Study - Clinical Global Impression of Change (ADCS CGIC) score.; Change in the Electroencephalogram's (EEG) overall power spectral density; Caregiver reported treatment compliance,,2017,2020; Recruiting,,,
,NCT04122001,N/A,AD,60,"One week before intervention and one week post intervention, up to 8 w","Change in auditory recall accuracy based on the sum of words recalled in Trials 1-5 of semantically related - trained word-lists; Change in auditory delayed recall accuracy of semantically related - trained word-lists; Change in auditory recall accuracy based on the sum of words recalled in Trials 1-5 of semantically unrelated - trained word-lists; Change in auditory delayed recall accuracy of semantically unrelated - trained word-lists; Change in auditory recall accuracy based the sum of words recalled in Trials 1-5 of semantically related - untrained word-lists; Change in auditory delayed recall accuracy of semantically related - untrained word-lists; Change in auditory recall accuracy based on the sum of words recalled in Trials 1-5 of semantically unrelated - untrained word-lists; Change in auditory delayed recall accuracy of semantically unrelated - untrained word-lists; Change in Rey Auditory-Verbal Learning Test (RAVLT) score; Change in Mini Mental State Examination (MMSE); Change in Mnemonic Similarity Task (MST) score; Change in word repetition score; Change in non-word repetition score; Change in sentence repetition score; Change in oral naming Boston Naming Test score; Change in oral naming Philadelphia Naming Test score; Change in written naming as assessed by Boston Naming Test; Change in written naming as assessed by Philadelphia Naming Test; Change in oral naming of action as assessed by Hopkins Assessment of Naming Actions (HANA); Change in syntactic comprehension as assessed by Subject-relative, Object-relative, Active, Passive (S.O.A.P.) Syntactic Battery; Change in verbal fluency task score; Change in spelling as assessed by the Johns Hopkins Dysgraphia battery; Change in digit span forward score; Change in digit span backward score; Change in spatial span forward score; Change in spatial span backward score; Change in semantic content of connected speech; Change in attention and manipulation of information scores; Change in volumetric measurements of select brain regions; Change in functional connectivity of select brain regions (z-correlations); Change in Gamma-Aminobutyric Acid (GABA) concentration; Change in location of white matter tracts of select brain regions; Change in anisotropy of white matter tracts of select brain regions; Correlation of primary and secondary outcomes with sleep efficiency",,2019,2020; Recruiting,,,
,NCT04182529,N/A,MCI,40,"through study completion, an average of 2 year",N-Back Test (cognitive test battery); Category Fluency Test; The Hong Kong List Learning Test; The Chinese Version of the Mattis Dementia Rating Scale; NIRS Recording; EEG Recordings,,2019,2019; Recruiting,,,
,NCT00856518,P2/P3,PD,42,at baseline and after 5-week of EMST exercise,Swallow-related Quality of Life (SWAL-QOL); Penetration-Aspiration Scale Score; Maximum Expiratory Pressure (MEP),,2009,2017; Completed,,,
,NCT02221544,N/A,PD,20,One week post intervention,Changes in frequency and severity of the freezing of gait phenomenon; Community ambulation; Changes in endurance; Balance; Immediate changes in blood pressure; Immediate change in gait function,,2014,2014; Unknown status,,,
,NCT01885806,P2,AD,40,"4th week, 8th week, 12th week",Change in apathy symptoms; Change in ADAS-Cog scores; Change in the Zarit Burden Scale; Safety assessment,,2013,2013; Unknown status,,,
Sham Stimulation,NCT04157621,N/A,PD,30,Screening to Day 13 (Visit 9),Change in Motor Function score as assessed by modified Movement Disorder Society Unified Parkinson's Disease Rating Scale (MDS-UPDRS) Part III; Change in Cognitive Function score,,2019,2021; Recruiting,,,
,NCT02351388,N/A,AD,4,baseline,Attrition rate due to any adverse event; Rate of adverse events related to tDCS procedure; Geriatric Depression Scale; Cornell Scale for Depression in Dementia; Neuropsychiatric Inventory; Zarit Burden Interview; Clinical Global Impression of Improvement; Starkstein Apathy Scale; Clinical Dementia Rating; Quality of Life - Alzheimer's Disease; ADCS-ADL,,2015,2020; Terminated,,,
transcranial direct current stimulation (tDCS),NCT04759092,N/A,AD,8,8 m,To investigate tolerability; To investigate effect of the treatment,,2021,2021; Recruiting,,,
,NCT04237948,N/A,"PD, PSP",20,Changes from Baseline to immediately after stimulation,PSP rating scale (PSP-RS); Falls; Cognitive testing; Static Balance- area of sway; Tinetti Balance test (TBT); Static Balance: wearable sensor analyses - velocity; Gait speed; Turning speed; Activity of daily living,,2020,2020; Completed,,,
,NCT03422250,N/A,"AD, FTDLD",66,"Baseline, post tDCS (week 3)",Change from baseline in behavioral symptom severity; Change from baseline in clinical disease severity; Change from baseline in functional connectivity; Change from baseline in perfusion; Change from baseline in cognition: memory; Change from baseline in cognition: language; Change from baseline in cognition: executive function; Change from baseline in cognition: visuospatial function; Change from baseline in cognition: emotion recognition; Change from baseline in structural connectivity,,2018,2018; Completed,,,
,NCT03227783,N/A,PD,26,"(1) before the 1st visit (within one month) (2) after the 3rd tDCS, within 24 hours (on the same day as the 3rd tDCS)",BDI score; HDRS score; MADRS score; resting state functional MRI,,2017,2018; Recruiting,,,
,NCT02287207,N/A,PD,20,post-stimulation (immediately after) and retention (1 week),Change in writing amplitude; Change in writing velocity; Change in speed on the Purdue Pegboard task; Change in cortical excitability; Change in Short-Latency Intracortical Inhibition (SICI); Change in cortical silent period (cSP),,2014,2016; Completed,,,
rTMS,NCT03373981,N/A,ALS,15,recorded once a week for the 4 week duration of the study.,To evaluate safety and efficacy of repetitive transcranial magnetic stimulation (rTMS) using the FDA approved protocol in research subjects with ALS and other Neurodegenerative disorders.; To understand the impact of rTMS in addressing the mood symptoms associated with ALS.,,2017,2021; Recruiting,,,
,NCT04176406,N/A,MCI,10,Through study completion an average of one year,"Acute Effect of a rTMS Session on the Performance for a Working Memory Task, as Measured by Reaction Times (ms); Acute Effect of a rTMS Session on the Performance for a Working Memory Task, as Measured by Accuracy (in Percentage)",,2019,2021; Terminated,,,
,NCT03059212,N/A,PD,60,up to 12 w,Change of Repeatable Battery for the Assessment of Neuropsychological Status; Change of Montreal Cognitive Assessment ; MoCA,,2017,2021; Recruiting,,,
,NCT03217110,N/A,PD,200,During the 1 week of treatment comparing pre- and post-stimulation scans.,"Schizophrenia group: Change in Calgary depression scale.; Bipolar group: Change in Young Mania Rating Scale.; Change in cognitive function.; Change in disease-specific symptom rating scale, one scale identified for each group (MADRS for bipolar group; PANSS for schizophrenia group; UPDRS in Parkinson's patient group).; Change in brain rhythms; Change in cognitive function; Changes in functional MRI; Change in NIH Toolbox emotion battery; Change in motor function; Bipolar group: Change in Columbia Suicide Severity Rating Scale.; Change in PHQ9 score.; Change in CGI.; Changes in structural MRI.; Changes in MRI-based timing task.; Changes in DTI.; Changes in T1 rho MRI signal.",,2017,2020; Recruiting,,,
,NCT03342846,N/A,PD,40,Two w,change in motor disability; Changes in Cortical excitability,,2017,2020; Completed,,,
,NCT04263194,N/A,AD,60,"At baseline (T0), up to 4 w (T1), through study completion, an average of 6 m (T2)",Change in ADAS-Cog scale scores; Change in CANTAB battery scores; Change in brain connectivity; Change in brain plasticity; Change in MRI measures of functional and structural connectivity,,2020,2020; Recruiting,,,
,NCT03879551,N/A,PD,30,10 d,changes in Mini Mental State Examination (MMSE); changes in Montreal cognitive assessment scale (MoCA); Event related potential P300; motor part of Unified Parkinson's disease rating scale (UPDRS); changes in cortical excitability,,2019,2020; Completed,,,
,NCT04431570,N/A,PD,66,"through study completion, an average of 10 d",the change of freezing of gait questionnaire (FOGQ); the change of freezing of gait score (FOG score); the change of score of Movement Disorder Society-Unified Parkinson's Disease Rating Scale (MDS-UPDRS) part III; the change of Hamilton Depression (HAMD) Scale; the change of Mini-mental State Examination (MMSE) scale; the change of Parkinson's Disease Questionnaire (PDQ-39); functional image of the brain (FMRI),,2020,2020; Not yet recruiting,,,
